"node";"cluster";"description"
155;7;"SILVER DROP EARRINGS WITH FLOWER"
155;7;"RUBY DROP CHANDELIER EARRINGS"
155;7;"PURPLE CRYSTAL DROP EARRINGS"
155;7;"DROP DIAMANTE EARRINGS BLACK DIAMON"
155;7;"BLACK CRYSTAL DROP EARRINGS"
155;7;"MIDNIGHT BLUE CRYSTAL DROP EARRINGS"
155;7;"BLACK 3 BEAD DROP EARRINGS"
155;7;"SILVER/CRYSTAL DROP EARRINGS W LEAF"
155;7;"AMBER CRYSTAL DROP EARRINGS"
155;7;"BLACK DROP EARRINGS W LONG BEADS"
155;7;"BLUE DROP EARRINGS W BEAD CLUSTER"
155;7;"AMETHYST 3 BEAD DROP EARRINGS"
155;7;"GREEN CRYSTAL DROP EARRINGS"
155;7;"AMBER 3 BEAD DROP EARRINGS"
156;8;"FILIGREE DIAMANTE EARRINGS"
156;8;"CLASSIC DIAMANTE NECKLACE JET"
156;8;"CLASSIC DIAMANTE EARRINGS JET"
156;8;"FILIGREE DIAMANTE CHAIN"
157;8;"ART LIGHTS,FUNK MONKEY"
157;8;"FOLK ART GREETING CARD,pack/12"
157;8;"SAVOY ART DECO CLOCK"
157;8;"WRAP FOLK ART"
157;8;"FREESTYLE CANVAS ART PICTURE"
157;8;"CHERRY BLOSSOM CANVAS ART PICTURE"
159;1;"TRAVEL CARD WALLET FLOWER MEADOW"
159;1;"TRAVEL CARD WALLET PANTRY"
159;1;"TRAVEL CARD WALLET SKULLS"
159;1;"TRAVEL CARD WALLET VINTAGE ROSE "
159;1;"TRAVEL CARD WALLET TRANSPORT"
159;1;"TRAVEL CARD WALLET RETROSPOT"
159;1;"TRAVEL CARD WALLET KEEP CALM"
159;1;"TRAVEL CARD WALLET RETRO PETALS"
159;1;"TRAVEL CARD WALLET SUKI"
159;1;"TRAVEL CARD WALLET VINTAGE TICKET"
159;1;"TRAVEL CARD WALLET UNION JACK"
159;1;"TRAVEL CARD WALLET I LOVE LONDON"
159;1;"TRAVEL CARD WALLET VINTAGE LEAF"
159;1;"TRAVEL CARD WALLET DOTCOMGIFTSHOP"
160;1;"FELTCRAFT CUSHION OWL"
160;1;"FELTCRAFT CUSHION RABBIT"
160;1;"FELTCRAFT CUSHION BUTTERFLY"
160;1;"RETROSPOT PADDED SEAT CUSHION"
160;1;"FLOOR CUSHION ELEPHANT CARNIVAL"
160;1;"PADS TO MATCH ALL CUSHIONS"
161;9;"ROBOT MUG IN DISPLAY BOX"
161;9;"NEW ENGLAND MUG W GIFT BOX"
162;5;"FRUIT SALAD BAG CHARM"
162;5;"METALIC LEAVES BAG CHARMS"
162;5;"COPPER AND BRASS BAG CHARM"
162;5;"IVORY GOLD METAL BAG CHARM"
162;5;"WHITE WITH METAL BAG CHARM"
162;5;"GREEN WITH METAL BAG CHARM"
163;5;"FRENCH ENAMEL CANDLEHOLDER"
163;5;"PAIR OF ENAMEL BUTTERFLY HAIRCLIP"
163;5;"FRENCH ENAMEL POT W LID"
163;5;"FRENCH ENAMEL UTENSIL HOLDER"
163;5;"FRENCH ENAMEL WATER BASIN"
164;5;"ENAMEL FLOWER JUG CREAM"
164;5;"ENAMEL FIRE BUCKET CREAM"
164;5;"ENAMEL BREAD BIN CREAM"
164;5;"ENAMEL MEASURING JUG CREAM"
164;5;"ENAMEL COLANDER CREAM"
164;5;"ENAMEL WASH BOWL CREAM"
164;5;"GREEN ENAMEL FLOWER HAIR TIE"
164;5;"PURPLE ENAMEL FLOWER HAIR TIE"
164;5;"PINK ENAMEL FLOWER HAIR TIE"
164;5;"WHITE ENAMEL FLOWER HAIR TIE"
165;6;"FLOWER BURST SILVER RING CRYSTAL"
165;6;"BLACK ENAMEL FLOWER RING"
165;6;"GREEN ENAMEL FLOWER RING"
165;6;"RED ENAMEL FLOWER RING"
165;6;"PURPLE ENAMEL FLOWER RING"
166;6;"WHITE METAL LANTERN"
166;6;"WHITE LOVEBIRD LANTERN"
166;6;"WHITE WIRE EGG HOLDER"
166;6;"CHRISTMAS CRAFT WHITE FAIRY "
166;6;"PLACE SETTING WHITE STAR"
166;6;"PINK & WHITE BREAKFAST TRAY"
166;6;"CAKE PLATE LOVEBIRD WHITE"
166;6;"FOUR HOOK  WHITE LOVEBIRDS"
166;6;"PINK & WHITE ROSEBUD RING"
166;6;"WHITE BAMBOO RIBS LAMPSHADE"
166;6;"FELT FARM ANIMAL WHITE BUNNY "
166;6;"SPACE CADET WHITE"
166;6;"WHITE TISSUE REAM"
166;6;"BLUE & WHITE BREAKFAST TRAY"
166;6;"WHITE SAGE INCENSE"
166;6;"WHITE AND BLUE CERAMIC OIL BURNER"
166;6;"WHITE HAND TOWEL WITH BUTTERFLY"
166;6;"WHITE BEADED GARLAND STRING 20LIGHT"
166;6;"FROSTED WHITE BASE "
166;6;"WHITE CHRISTMAS FLOCK DROPLET "
166;6;"LOVE SEAT ANTIQUE WHITE METAL"
166;6;"CANDLE PLATE LACE WHITE"
166;6;"WHITE TEA,COFFEE,SUGAR JARS"
166;6;"CAKE STAND LACE WHITE"
166;6;"WHITE ROSEBUD  PEARL EARRINGS"
166;6;"WHITE SQUARE TABLE CLOCK"
166;6;"WHITE CHERRY LIGHTS"
166;6;"BLUE WHITE PLASTIC RINGS LAMPSHADE"
166;6;"CROCHET WHITE RABBIT KEYRING "
166;6;"WHITE FRANGIPANI HAIR CLIP"
166;6;"WHITE WICKER STAR "
167;6;"WOOD 2 DRAWER CABINET WHITE FINISH"
167;6;"WOOD S/3 CABINET ANT WHITE FINISH"
167;6;"WOOD BLACK BOARD ANT WHITE FINISH"
167;6;"ORGANISER WOOD ANTIQUE WHITE "
167;6;"WHITE WOOD GARDEN PLANT LADDER"
167;6;"TABLE LAMP WHITE SHADE WOOD BASE"
167;6;"FLOOR LAMP SHADE WOOD BASE"
167;6;"3 DRAWER ANTIQUE WHITE WOOD CABINET"
168;6;"BLUE OWL SOFT TOY"
168;6;"TOOL BOX SOFT TOY "
168;6;"DOCTOR'S BAG SOFT TOY"
168;6;"LITTLE GREEN MONSTER SOFT TOY"
168;6;"FLORAL SOFT CAR TOY"
168;6;"MOUSEY LONG LEGS SOFT TOY"
168;6;"PINK OWL SOFT TOY"
168;6;"NURSE'S BAG SOFT TOY"
168;6;"MR ROBOT SOFT TOY"
168;6;"MRS ROBOT SOFT TOY"
168;6;"LITTLE PINK MONSTER SOFT TOY"
169;6;"DOORMAT NEW ENGLAND"
169;6;"DOORMAT TOPIARY"
169;6;"DOORMAT HEARTS"
169;6;"DOORMAT WELCOME PUPPIES"
169;6;"DOORMAT AIRMAIL "
169;6;"DOORMAT 3 SMILEY CATS"
169;6;"DOORMAT I LOVE LONDON"
169;6;"DOORMAT WELCOME TO OUR HOME"
169;6;"DOORMAT RESPECTABLE HOUSE"
169;6;"DOORMAT MERRY CHRISTMAS RED "
169;6;"DOORMAT NEIGHBOURHOOD WITCH "
169;6;"DOORMAT WELCOME SUNRISE"
169;6;"DOORMAT FRIENDSHIP "
169;6;"DOORMAT MULTICOLOUR STRIPE"
169;6;"DOORMAT CHRISTMAS VILLAGE"
169;6;"DOORMAT KEEP CALM AND COME IN"
170;6;"WRAP COWBOYS  "
170;6;"WRAP CHRISTMAS SCREEN PRINT"
170;6;"FANCY FONTS BIRTHDAY WRAP"
170;6;"SKULLS AND CROSSBONES WRAP"
170;6;"GINGHAM ROSE WRAP"
170;6;"WRAP GREEN PEARS "
170;6;"WRAP CHRISTMAS VILLAGE"
170;6;"WRAP SUKI AND FRIENDS"
170;6;"WRAP BLUE RUSSIAN FOLKART"
170;6;"WRAP I LOVE LONDON "
170;6;"BLUE SCANDINAVIAN PAISLEY WRAP"
170;6;"WRAP GREEN RUSSIAN FOLKART "
170;6;"WRAP CIRCUS PARADE"
170;6;"WRAP MONSTER FUN "
170;6;"TOYBOX  WRAP "
170;6;"TEA PARTY  WRAPPING PAPER "
170;6;"WRAP DAISY CARPET "
170;6;"WRAP WEDDING DAY"
170;6;"WRAP, CAROUSEL"
170;6;"WRAP BAD HAIR DAY"
170;6;"WRAP CAROUSEL"
170;6;"WRAP GINGHAM ROSE "
170;6;"WRAP ALPHABET POSTER  "
170;6;"WRAP BIRD GARDEN "
170;6;"WRAP PAISLEY PARK "
170;6;"WRAP RED DOILEY"
170;6;"WRAP FLOWER SHOP  "
170;6;"WRAP MAGIC FOREST "
170;6;"ROLL WRAP VINTAGE SPOT "
170;6;"WRAP  VINTAGE DOILEY "
170;6;"WRAP  VINTAGE DOILY "
170;6;"KEEP CALM BIRTHDAY WRAP"
170;6;"WRAP KEEP CALM BIRTHDAY"
170;6;"WRAP A PRETTY THANK YOU"
171;6;"YULETIDE IMAGES GIFT WRAP SET"
171;6;"SPACEBOY GIFT WRAP"
171;6;"VINTAGE CARAVAN GIFT WRAP"
171;6;"PINK PAISLEY ROSE GIFT WRAP"
171;6;"BIRTHDAY BANQUET GIFT WRAP"
171;6;"ROMANTIC IMAGES GIFT WRAP SET"
171;6;"CURIOUS IMAGES GIFT WRAP SET"
171;6;"BLOSSOM IMAGES GIFT WRAP SET"
171;6;"EMPIRE GIFT WRAP"
171;6;"BOTANICAL ROSE GIFT WRAP"
171;6;"SET OF THREE VINTAGE GIFT WRAPS"
171;6;"BOTANICAL LAVENDER GIFT WRAP "
171;6;"BOTANICAL LILY GIFT WRAP"
172;7;"PINK FAIRY CAKE CHILDRENS APRON"
172;7;"WRAP PINK FAIRY CAKES "
172;7;"PINK FAIRY CAKE CUSHION COVER"
173;7;"CERAMIC CAKE STAND + HANGING CAKES"
173;7;"MINI CAKE STAND WITH HANGING CAKES"
173;7;"CERAMIC CAKE BOWL + HANGING CAKES"
173;7;"LARGE CAKE STAND HANGING HEARTS"
173;7;"LARGE CAKE STAND  HANGING STRAWBERY"
173;7;"MINI CAKE STAND  HANGING STRAWBERY"
174;7;"TURQ STONE/CRYSTAL EARRINGS"
174;7;"GREEN STONE/CRYSTAL EARRINGS"
174;7;"RED STONE/CRYSTAL EARRINGS"
174;7;"WHITE STONE/CRYSTAL EARRINGS"
175;7;"CRYSTAL STUD EARRINGS ASSORTED COL "
175;7;"BAROQUE BUTTERFLY EARRINGS PINK"
175;7;"BAROQUE BUTTERFLY EARRINGS BLACK"
175;7;"BAROQUE BUTTERFLY EARRINGS RED"
175;7;"CRYSTAL STUD EARRINGS CLEAR DISPLAY"
175;7;"BAROQUE BUTTERFLY EARRINGS MONTANA"
175;7;"BAROQUE BUTTERFLY EARRINGS CRYSTAL"
176;8;"MIRRORED WALL ART FOXY"
176;8;"MIRRORED WALL ART GENTS"
176;8;"MIRRORED WALL ART STARS"
176;8;"MIRRORED WALL ART PHOTO FRAMES"
176;8;"MIRRORED WALL ART SPLODGES"
176;8;"MIRRORED WALL ART TABLE LAMP"
176;8;"MIRRORED WALL ART SKULLS"
176;8;"DIAMANTE HEART SHAPED WALL MIRROR, "
176;8;" OVAL WALL MIRROR DIAMANTE "
176;8;"WALL MIRROR RECTANGLE DIAMANTE PINK"
176;8;"MIRRORED DOVE WALL DECORATION"
176;8;"MIRRORED WALL ART POPPIES"
176;8;"MIRRORED WALL ART LADIES"
176;8;"MIRRORED WALL ART SNOWFLAKES"
176;8;"ROCOCO WALL MIRROR WHITE"
177;8;"HORSE & PONY WALL ART"
177;8;"BICYCLE SAFTEY WALL ART"
177;8;"STOP FOR TEA WALL ART"
177;8;"WALL ART CLASSIC PUDDINGS "
177;8;"BUFFALO BILL WALL ART "
177;8;"WALL ART WORK REST AND PLAY  "
177;8;"WALL ART LOVES' SECRET "
177;8;"DOG AND BALL WALL ART"
177;8;"DOG LICENCE WALL ART"
177;8;"WALL ART GARDEN HAVEN "
177;8;"70'S ALPHABET WALL ART"
177;8;"SPACEBOY WALL ART"
177;8;"KEEP CALM WALL ART "
177;8;"WALL ART ONLY ONE PERSON "
177;8;"WALL ART VINTAGE HEART"
177;8;"CAT AND BIRD WALL ART"
177;8;"TREASURE AHOY WALL ART"
177;8;"WALL ART BIG LOVE "
177;8;"ANIMALS AND NATURE WALL ART"
177;8;"DOLLY GIRL WALL ART"
177;8;"VILLAGE SHOW WALL ART"
177;8;"WALL ART MID CENTURY MODERN "
177;8;"WALL ART THE MAGIC FOREST "
177;8;"I LOVE LONDON WALL ART"
177;8;"WALL ART KEEP CALM "
177;8;"WALL ART BICYCLE SAFTEY "
177;8;"WALL ART BUFFALO BILL "
177;8;"WALL ART VILLAGE SHOW "
177;8;"WALL ART STOP FOR TEA "
177;8;"WALL ART DOG LICENCE "
177;8;"WALL ART SPACEBOY"
177;8;"WALL ART I LOVE LONDON "
177;8;"WALL ART 70'S ALPHABET "
177;8;"WALL ART HORSE & PONY "
177;8;"WALL ART ANIMALS AND NATURE "
177;8;"WALL ART CAT AND BIRD "
177;8;"WALL ART BICYCLE SAFETY"
177;8;"WALL ART DOLLY GIRL "
177;8;"WALL ART DOG AND BALL "
177;8;"WALL ART , LOVES' SECRET "
177;8;"WALL ART,ONLY ONE PERSON "
177;8;"WALL ART ,PUDDINGS "
177;8;"WALL ART , THE MAGIC FOREST "
177;8;"WALL ART TREASURE AHOY "
178;8;"ICON PLACEMAT POP ART ELVIS"
178;8;"POP ART PUSH DOWN RUBBER "
179;1;"CHERRY BLOSSOM PASSPORT COVER"
179;1;"FIRST CLASS PASSPORT COVER "
179;1;"TROPICAL PASSPORT COVER "
179;1;"QUEEN OF THE SKIES PASSPORT COVER "
179;1;"VIP PASSPORT COVER "
180;1;"FRENCH LATTICE CUSHION COVER "
180;1;"FRENCH PAISLEY CUSHION COVER "
180;1;"FRENCH FLORAL CUSHION COVER "
180;1;"GREEN CAT FLORAL CUSHION COVER "
180;1;"WOVEN BERRIES CUSHION COVER "
180;1;"WHITE STITCHED CUSHION COVER"
180;1;"BLUE/CREAM STRIPE CUSHION COVER "
180;1;"UNION STRIPE CUSHION COVER "
180;1;"FUNKY MONKEY CUSHION COVER"
180;1;"WOVEN FROST CUSHION COVER"
180;1;"WOVEN CANDY CUSHION COVER "
180;1;"WOVEN BUBBLE GUM CUSHION COVER"
180;1;"GREEN POP ART MAO CUSHION COVER "
180;1;"CANDY SPOT CUSHION COVER"
180;1;"PINK PAISLEY CUSHION COVER "
180;1;"BLUE FLOCK CUSHION COVER "
180;1;"WOVEN ROSE GARDEN CUSHION COVER "
180;1;"WOVEN SUNSET CUSHION COVER "
180;1;"BLUE GINGHAM ROSE CUSHION COVER"
180;1;"BLUE CHENILLE SHAGGY CUSHION COVER "
180;1;"PINK CAT FLORAL CUSHION COVER "
180;1;"ROSE DU SUD CUSHION COVER"
180;1;"PINK BUTTERFLY CUSHION COVER "
180;1;"RED/CREAM STRIPE CUSHION COVER "
180;1;"BLUE CUSHION COVER WITH FLOWER"
180;1;"PINK YELLOW PATCH CUSHION COVER"
180;1;"ROSE DU SUD CUSHION COVER "
180;1;"PINK BUTTERFLY CUSHION COVER"
180;1;"GOLD FLOWER CUSHION COVER "
180;1;"FRENCH PAISLEY CUSHION COVER"
180;1;"GREEN PEONY CUSHION COVER"
180;1;"PINK FLOCK SUEDE CUSHION COVER "
180;1;"BUTTERFLY CUSHION COVER"
180;1;"BELLE JARDINIERE CUSHION COVER"
180;1;"POSTE FRANCE CUSHION COVER"
180;1;"LA JARDIN BOTANIQUE CUSHION COVER"
180;1;"LE JARDIN BOTANIQUE CUSHION COVER"
181;9;"TOADSTOOL MONEY BOX"
181;9;"RECIPE BOX PANTRY YELLOW DESIGN"
181;9;"RECIPE BOX BLUE SKETCHBOOK DESIGN"
181;9;"MONEY BOX POCKET MONEY DESIGN"
181;9;"MONEY BOX BISCUITS DESIGN"
181;9;"MONEY BOX CONFECTIONERY DESIGN"
181;9;"MONEY BOX KINGS CHOICE DESIGN"
181;9;"MONEY BOX HOUSEKEEPING DESIGN"
181;9;"MONEY BOX FIRST ADE DESIGN"
181;9;"MONEY BOX FIRST AID DESIGN"
182;9;"BOUDOIR SQUARE TISSUE BOX"
182;9;"SKULLS SQUARE TISSUE BOX"
182;9;"CARAVAN SQUARE TISSUE BOX"
182;9;"BLUE PAISLEY TISSUE BOX"
182;9;"PINK PAISLEY SQUARE TISSUE BOX "
182;9;"SWALLOW SQUARE TISSUE BOX"
182;9;"LADS ONLY TISSUE BOX"
182;9;"EMPIRE TISSUE BOX"
182;9;"MOTORING TISSUE BOX"
183;9;"GREEN METAL BOX ARMY SUPPLIES"
183;9;"RED METAL BOX TOP SECRET"
183;9;"GREEN METAL BOX TOP SECRET"
184;10;"GREEN ENAMEL+GLASS HAIR COMB"
184;10;"PINK ENAMEL+GLASS HAIR COMB"
184;10;"JADE GREEN ENAMEL HAIR COMB"
184;10;"2 DAISIES HAIR COMB"
184;10;"DAISY HAIR COMB"
184;10;"DAISY HAIR BAND"
184;10;"PURPLE ENAMEL+GLASS HAIR COMB"
185;10;"PASTEL COLOUR HONEYCOMB FAN"
185;10;"MULTICOLOUR HONEYCOMB FAN"
185;10;"SANDALWOOD FAN"
185;10;"PAPER POCKET TRAVELING FAN "
185;10;"PINK  HONEYCOMB PAPER FAN"
186;6;"WHITE BELL HONEYCOMB PAPER "
186;6;"WHITE HONEYCOMB PAPER GARLAND "
186;6;"LARGE WHITE HONEYCOMB PAPER BELL  "
186;6;"3D HEARTS  HONEYCOMB PAPER GARLAND"
186;6;"STRAWBERRY HONEYCOMB  GARLAND "
186;6;"TROPICAL  HONEYCOMB PAPER GARLAND "
186;6;"MULTICOLOUR HONEYCOMB PAPER GARLAND"
186;6;"WHITE BELL HONEYCOMB PAPER GARLAND "
186;6;"DOLLY HONEYCOMB GARLAND"
186;6;"DAISIES  HONEYCOMB GARLAND "
186;6;"WHITE DOVE HONEYCOMB PAPER GARLAND"
187;6;"MULTICOLOUR  CONFETTI IN TUBE"
187;6;"PINK  HEART CONFETTI IN TUBE"
187;6;"ROUND WHITE CONFETTI IN TUBE"
187;6;"WHITE HEART CONFETTI IN TUBE"
188;6;"RETRO LONGBOARD IRONING BOARD COVER"
188;6;"PINK/PURPLE RETRO RADIO"
188;6;"RETRO PINK BALL ASHTRAY "
188;6;"SET/4 WHITE RETRO STORAGE CUBES "
188;6;"RETRO ""TEA FOR ONE"" "
188;6;"RETRO BROWN BALL ASHTRAY "
188;6;"FUSCHIA RETRO BAR STOOL"
188;6;"RETRO PILL BOX , REVOLUTIONARY"
188;6;"YELLOW/BLUE RETRO RADIO"
188;6;"RETRO PILL BOX KEY CHAIN,THE KING"
188;6;"RETRO LEAVES MAGNETIC NOTEPAD"
189;6;"CLEAR ACRYLIC FACETED BANGLE"
189;6;"PURPLE DRAWERKNOB ACRYLIC EDWARDIAN"
189;6;"RED   ACRYLIC FACETED BANGLE"
189;6;"GREY ACRYLIC FACETED BANGLE"
189;6;"PURPLE ACRYLIC FACETED BANGLE"
190;6;"MOODY GIRL DOOR HANGER "
190;6;"DO NOT TOUCH MY STUFF DOOR HANGER "
190;6;"KEEP OUT BOYS DOOR HANGER "
190;6;"MOODY BOY  DOOR HANGER "
190;6;"TOXIC AREA  DOOR HANGER "
190;6;"DOOR HANGER  MUM + DADS ROOM"
190;6;"KEEP OUT GIRLS DOOR HANGER "
193;7;"MINI FUNKY DESIGN TAPES"
193;7;"GOLD MINI TAPE MEASURE "
193;7;"BLACK MINI TAPE MEASURE "
193;7;"SILVER MINI TAPE MEASURE "
194;7;"MINI JIGSAW CIRCUS PARADE "
194;7;"MINI JIGSAW SPACEBOY"
194;7;"MINI JIGSAW DINOSAUR "
194;7;"MINI JIGSAW BAKE A CAKE "
194;7;"MINI JIGSAW BUNNIES"
194;7;"MINI JIGSAW PURDEY"
194;7;"MINI JIGSAW GO TO THE FAIR"
194;7;"MINI JIGSAW LEAP FROG"
194;7;" I LOVE LONDON MINI BACKPACK"
194;7;"SPACEBOY MINI BACKPACK"
194;7;"WOODLAND MINI BACKPACK"
194;7;"SPACEBOY MINI RUCKSACK"
194;7;" I LOVE LONDON MINI RUCKSACK"
194;7;"WOODLAND MINI RUCKSACK "
194;7;"MINI LIGHTS WOODLAND MUSHROOMS"
195;7;"CANDY SPOT EGG WARMER HARE"
195;7;"HILDA CANDY SPOT RABBIT"
195;7;"CANDY SPOT EGG WARMER RABBIT"
195;7;"CANDY SPOT HAND BAG"
195;7;"CANDY SPOT BUNNY"
195;7;"CANDY SPOT TEA COSY"
196;7;"EASTER TREE YELLOW BIRDS"
196;7;"EASTER CRAFT 4 CHICKS "
196;7;"EASTER CRAFT IVY WREATH WITH CHICK"
197;8;"SWEETHEART WIRE WALL TIDY"
197;8;"WALL TIDY RETROSPOT "
197;8;"A4 WALL TIDY BLUE OFFICE"
197;8;"CD WALL TIDY BLUE OFFICE"
197;8;"SIX DRAWER OFFICE TIDY"
197;8;" NINE DRAWER OFFICE TIDY"
197;8;"SWEETHEART WALL TIDY "
198;8;"LA PALMIERA WALL THERMOMETER"
198;8;"PSYCHEDELIC WALL THERMOMETER"
198;8;"FRUIT TREE AND BIRDS WALL PLAQUE"
198;8;"ROCOCO WALL MIROR"
199;8;"RED FLOWER CROCHET FOOD COVER"
199;8;"CHERRY CROCHET FOOD COVER"
199;8;"STRAWBERRY RAFFIA FOOD COVER"
199;8;"POLKA DOT RAFFIA FOOD COVER"
199;8;"LADYBIRD + BEE RAFFIA FOOD COVER"
199;8;"PINK FLOWER CROCHET FOOD COVER"
199;8;"FLOWER VINE RAFFIA FOOD COVER"
199;8;"BUTTERFLY CROCHET FOOD COVER"
200;1;"SQUARE FLOOR CUSHION VINTAGE RED"
200;1;"PIN CUSHION BABUSHKA RED"
200;1;"RED PEONY CUSHION COVER "
200;1;"ORIENTAL RED CUSHION COVER "
201;9;"SPACEBOY LUNCH BOX "
201;9;"LUNCH BOX I LOVE LONDON"
201;9;"CIRCUS PARADE LUNCH BOX "
201;9;"STRAWBERRY LUNCH BOX WITH CUTLERY"
201;9;"LUNCH BOX WITH CUTLERY RETROSPOT "
201;9;"DINOSAUR LUNCH BOX WITH CUTLERY"
201;9;"SKULL LUNCH BOX WITH CUTLERY "
201;9;"LUNCH BOX WITH CUTLERY FAIRY CAKES "
202;9;"RECIPE BOX WITH METAL HEART"
202;9;"ROSE COTTAGE KEEPSAKE BOX "
202;9;"WOODEN BOX OF DOMINOES"
202;9;"CHOCOLATE BOX RIBBONS "
202;9;"BOOM BOX SPEAKER GIRLS"
202;9;"S/4 VALENTINE DECOUPAGE HEART BOX"
202;9;"COSY HOUR CIGAR BOX MATCHES "
202;9;"PIZZA PLATE IN BOX"
202;9;"BUTTON BOX "
202;9;"MA CAMPAGNE CUTLERY BOX"
202;9;"STRIPEY CHOCOLATE NESTING BOXES"
202;9;"SET3 BOOK BOX GREEN GINGHAM FLOWER "
202;9;"BOOM BOX SPEAKER BOYS"
202;9;"SHOE SHINE BOX "
202;9;"YULETIDE IMAGES S/6 PAPER BOXES"
202;9;"BOXED GLASS ASHTRAY"
202;9;"NEW BAROQUE JEWELLERY BOX "
202;9;"BUNNY EGG BOX"
202;9;"HEART BUTTONS JEWELLERY BOX"
202;9;"TREASURE ISLAND BOOK BOX"
202;9;"BUFFALO BILL TREASURE BOOK BOX"
202;9;"GYMKHANNA TREASURE BOOK BOX"
202;9;"ABC TREASURE BOOK BOX "
202;9;"GYMKHANA TREASURE BOOK BOX"
202;9;"ZINC BOX SIGN HOME"
202;9;"GINGHAM RECIPE BOOK BOX"
202;9;"found box"
202;9;"crushed boxes"
202;9;"DECROTIVEVINTAGE COFFEE GRINDER BOX"
202;9;"Wrongly mrked had 85123a in box"
202;9;"wet boxes"
203;10;"GREEN SQUARE COMPACT MIRROR"
203;10;"GREEN HEART COMPACT MIRROR"
203;10;"GREEN ROUND COMPACT MIRROR"
204;10;"JAM JAR WITH GREEN LID"
204;10;"GREEN POLKADOT PLATE "
204;10;"COSY SLIPPER SHOES SMALL GREEN"
204;10;"GREEN FERN NOTEBOOK"
204;10;"GREEN REGENCY TEACUP AND SAUCER"
204;10;"GREEN ROSE WASHBAG"
204;10;"MINT GREEN ROSE TOWEL"
204;10;"GREEN GEISHA GIRL "
204;10;"ROCKING HORSE GREEN CHRISTMAS "
204;10;"GREEN FERN JOURNAL "
204;10;"MIXED NUTS LIGHT GREEN BOWL"
204;10;"GREEN POLKADOT BOWL"
204;10;"COSY SLIPPER SHOES LARGE GREEN"
204;10;"LUSH GREENS RIBBONS"
204;10;"GREEN BITTY LIGHT CHAIN"
204;10;"PARTY PIZZA DISH GREEN POLKADOT"
204;10;"BIRD DECORATION GREEN POLKADOT"
204;10;"GREEN FERN SKETCHBOOK "
204;10;"COUNTRY COTTAGE  DOORSTOP GREEN"
204;10;"GREEN BIRDHOUSE DECORATION"
204;10;"GREEN METAL SWINGING BUNNY"
204;10;"CHILDRENS CUTLERY POLKADOT GREEN "
204;10;"RECYCLED ACAPULCO MAT GREEN"
204;10;"REGENCY SUGAR BOWL GREEN"
204;10;"REGENCY TEA PLATE GREEN "
205;10;"SWEETHEART RECIPE BOOK STAND"
205;10;"BLUE PAISLEY POCKET BOOK"
205;10;"CHRYSANTHEMUM POCKET BOOK "
205;10;"GARDEN PATH POCKET BOOK"
205;10;"RED DAISY POCKET BOOK "
205;10;"ABSTRACT CIRCLES POCKET BOOK"
205;10;"GREEN FERN POCKET BOOK"
206;6;"GLITTER STAR GARLAND WITH BELLS "
206;6;"GARLAND WITH STARS AND BELLS"
206;6;"GLITTER HEART GARLAND WITH BELLS "
206;6;"HOME GARLAND PAINTED ZINC "
206;6;"LOVE GARLAND PAINTED ZINC "
206;6;"MULTICOLOUR 3D BALLS GARLAND"
206;6;"ZINC FOLKART SLEIGH BELLS"
206;6;"GARLAND WITH HEARTS AND BELLS"
206;6;"NOEL GARLAND PAINTED ZINC "
206;6;"GARLAND, VINTAGE BELLS"
206;6;"VINTAGE BELLS GARLAND"
206;6;"CLASSIC CHROME BICYCLE BELL "
206;6;"CLASSIC CROME BICYCLE BELL "
207;11;"FAIRY SOAP SOAP HOLDER"
207;11;"WHITE BROCANTE SOAP DISH"
207;11;"SOAP DISH BROCANTE"
207;11;"STARFISH SOAP DISH"
207;11;"SCALLOP SHELL SOAP DISH"
207;11;"IVORY SWEETHEART SOAP DISH"
207;11;"ZINC SWEETHEART SOAP DISH"
208;11;"COSY HOUR GIANT TUBE MATCHES"
208;11;"KINGS CHOICE GIANT TUBE MATCHES"
208;11;"RETROSPOT SMALL TUBE MATCHES"
208;11;"RETROSPOT GIANT TUBE MATCHES"
209;6;"BEACH HUT KEY CABINET"
209;6;"WOOD AND GLASS MEDICINE CABINET"
209;6;"TWO DOOR CURIO CABINET"
209;6;"KEY CABINET MA CAMPAGNE"
209;6;"UTILTY CABINET WITH HOOKS"
209;6;"SQUARE CHERRY BLOSSOM CABINET"
209;6;"RUSTIC WOODEN CABINET, GLASS DOORS"
209;6;"SWEETHEART KEY CABINET"
209;6;"PARISIENNE KEY CABINET "
209;6;"PARISIENNE CURIO CABINET"
209;6;"CURIO CABINET LINEN AND LACE "
210;6;"UNION JACK FLAG LUGGAGE TAG"
210;6;"RED HEART LUGGAGE TAG"
210;6;"PINK UNION JACK  LUGGAGE TAG"
210;6;"THREE CANVAS LUGGAGE TAGS"
210;6;"RED RETROSPOT LUGGAGE TAG"
210;6;"CHERRY BLOSSOM LUGGAGE TAG"
210;6;"QUEEN OF SKIES LUGGAGE TAG"
210;6;"TROPICAL LUGGAGE TAG"
210;6;"ECONOMY LUGGAGE TAG"
210;6;"FIRST CLASS LUGGAGE TAG "
211;7;"POPPY'S PLAYHOUSE BEDROOM "
211;7;"POPPY'S PLAYHOUSE KITCHEN"
211;7;"POPPY'S PLAYHOUSE LIVINGROOM "
211;7;"POPPY'S PLAYHOUSE BATHROOM"
211;7;"POPPY FIELDS CHOPPING BOARD"
212;7;"WELCOME  WOODEN BLOCK LETTERS"
212;7;"JOY WOODEN BLOCK LETTERS"
212;7;"NOEL WOODEN BLOCK LETTERS "
212;7;"PEACE WOODEN BLOCK LETTERS"
212;7;"NURSERY A,B,C PAINTED LETTERS"
212;7;"BUNNY WOODEN PAINTED WITH FLOWER "
212;7;"BUNNY WOODEN PAINTED WITH BIRD "
212;7;"PAINTED YELLOW WOODEN DAISY"
213;7;"OVAL  MINI PORTRAIT FRAME"
213;7;"HEART MINI PORTRAIT FRAME"
213;7;"SQUARE MINI PORTRAIT FRAME"
213;7;"THREE MINI HANGING FRAMES"
214;7;"S/12 MINI RABBIT EASTER"
215;7;"EASTER DECORATION NATURAL CHICK"
215;7;"PINK FELT EASTER RABBIT GARLAND"
215;7;"RABBIT EASTER DECORATION"
215;7;"MULTICOLOUR EASTER RABBIT "
215;7;"FOUR RABBIT EASTER DECORATIONS"
215;7;"WHITE/PINK CHICK EASTER DECORATION"
215;7;"METAL RABBIT LADDER EASTER "
215;7;"PINK FLOWERS RABBIT EASTER"
216;7;"EASTER BUNNY GARLAND OF FLOWERS"
216;7;"EASTER TIN BUNNY BOUQUET"
216;7;"BUNNY EGG GARLAND"
216;7;"EASTER DECORATION SITTING BUNNY"
216;7;"EASTER DECORATION HANGING BUNNY"
216;7;"EASTER DECORATION EGG BUNNY "
216;7;"EASTER BUNNY HANGING GARLAND"
216;7;"EASTER BUNNY WITH BASKET ON BACK"
216;7;"EASTER BUNNY WREATH"
217;8;"HAND WARMER UNION JACK"
217;8;"VINTAGE UNION JACK CUSHION COVER"
217;8;"DOORMAT UNION JACK GUNS AND ROSES"
217;8;"VINTAGE UNION JACK BUNTING"
217;8;"VINTAGE UNION JACK APRON"
217;8;"EMPIRE UNION JACK TV DINNER TRAY"
217;8;"CUSHION COVER PINK UNION JACK"
217;8;"UNION JACK FLAG PASSPORT COVER "
217;8;"WOODEN UNION JACK BUNTING"
217;8;"VINTAGE UNION JACK DOORSTOP"
217;8;"VINTAGE UNION JACK MEMOBOARD"
217;8;"PINK UNION JACK  PASSPORT COVER "
217;8;"VINTAGE UNION JACK PENNANT"
217;8;"VINTAGE UNION JACK SHOPPING BAG"
217;8;"SQUARECUSHION COVER PINK UNION JACK"
217;8;"KEY RING BASEBALL BOOT UNION JACK"
218;8;"SQUARECUSHION COVER PINK UNION FLAG"
218;8;"DOORMAT UNION FLAG"
218;8;"FRYING PAN UNION FLAG"
218;8;"UNION FLAG WINDSOCK"
218;8;"FLAG OF ST GEORGE "
218;8;"FLAG OF ST GEORGE CHAIR"
218;8;"FLAG OF ST GEORGE CAR FLAG"
219;12;"BLACK VINTAGE EARRINGS"
219;12;"GREEN VINTAGE EARRINGS "
219;12;"MIDNIGHT BLUE VINTAGE EARRINGS"
219;12;"VINTAGE ENAMEL & CRYSTAL EARRINGS"
219;12;"PINK VINTAGE VICTORIAN EARRINGS"
219;12;"PURPLE VINTAGE EARRINGS"
219;12;"BLACK VINTAGE  CRYSTAL EARRINGS"
219;12;"WHITE VINTAGE CRYSTAL EARRINGS"
219;12;"BROWN VINTAGE VICTORIAN EARRINGS"
220;1;"JUMBO SHOPPER VINTAGE RED PAISLEY"
220;1;"VINTAGE RED TEATIME MUG"
220;1;"VINTAGE RED KITCHEN CABINET"
220;1;"VINTAGE RED MUG"
220;1;"VINTAGE RED ENAMEL TRIM JUG "
220;1;"RED VINTAGE SPOT BEAKER"
220;1;"VINTAGE RED ENAMEL TRIM MUG "
220;1;"VINTAGE RED ENAMEL TRIM PLATE"
220;1;"VINTAGE RED TRIM ENAMEL BOWL "
220;1;"WRAP RED VINTAGE DOILY"
220;1;"SNACK TRAY RED VINTAGE DOILY"
221;9;"STRAWBERRY CERAMIC TRINKET BOX"
221;9;"PINK CREAM FELT CRAFT TRINKET BOX "
221;9;"PINK BLUE FELT CRAFT TRINKET BOX"
221;9;"SWEETHEART CERAMIC TRINKET BOX"
221;9;"SILVER OVAL SHAPE TRINKET BOX"
221;9;"OYSTER TRINKET BOX"
221;9;"PINK OVAL SHAPE TRINKET BOX"
221;9;"GEORGIAN TRINKET BOX"
221;9;"MARIE ANTOIENETT TRINKET BOX GOLD"
221;9;"MARIE ANTOINETTE TRINKET BOX GOLD"
221;9;"MARIE ANTOINETTE TRINKET BOX SILVER"
221;9;"EMBOSSED HEART TRINKET BOX"
222;9;"VICTORIAN SEWING BOX LARGE"
222;9;"DELUXE SEWING KIT "
222;9;"TRAVEL SEWING KIT"
222;9;"VICTORIAN SEWING BOX SMALL "
222;9;"VICTORIAN SEWING BOX MEDIUM"
222;9;"VICTORIAN SEWING KIT"
222;9;"SEWING BOX RETROSPOT DESIGN "
222;9;"DANISH ROSE ROUND SEWING BOX"
222;9;"PARISIENNE SEWING BOX"
223;9;"BOX OF 9 PEBBLE CANDLES"
223;9;"4 VANILLA BOTANICAL CANDLES"
223;9;"4 WILDFLOWER BOTANICAL CANDLES"
224;10;"CRYSTAL DIAMANTE STAR BROOCH"
224;10;"DIAMANTE BOW BROOCH GREEN COLOUR"
224;10;"GOLD DIAMANTE STAR BROOCH"
225;10;"GUMBALL MAGAZINE RACK"
225;10;"SWEETHEART WIRE MAGAZINE RACK"
225;10;"MAGAZINE RACK GEBRA ASSORTED "
225;10;"CREAM SWEETHEART MAGAZINE RACK"
226;10;"CREAM SWEETHEART EGG HOLDER"
226;10;"CREAM SWEETHEART WALL CABINET"
226;10;"CREAM SWEETHEART LETTER RACK"
226;10;"CREAM SWEETHEART MINI CHEST"
226;10;"SWEETHEART WIRE FRUIT BOWL"
226;10;"SWEETHEART CARRY-ALL BASKET"
226;10;"CREAM SWEETHEART SHELF + HOOKS"
226;10;"SWEETHEART CREAM STEEL TABLE RECT"
226;10;"STEEL SWEETHEART ROUND TABLE CREAM"
226;10;"CREAM SWEETHEART TRAYS"
226;10;"ZINC SWEETHEART WIRE LETTER RACK"
226;10;"IVORY SWEETHEART WIRE LETTER RACK "
226;10;"IVORY WIRE SWEETHEART LETTER TRAY"
226;10;"ZINC WIRE SWEETHEART LETTER TRAY"
226;10;"SWEETHEART BIRD HOUSE"
227;11;"TV DINNER TRAY VINTAGE PAISLEY"
227;11;"TRAY, BREAKFAST IN BED"
227;11;"TV DINNER TRAY AIR HOSTESS "
227;11;"RETRO MOD TRAY"
227;11;"CORONA MEXICAN TRAY"
227;11;"RETRO PLASTIC ELEPHANT TRAY"
227;11;"SPACEBOY TV DINNER TRAY"
227;11;"RETRO PLASTIC POLKA TRAY"
227;11;"CERAMIC STRAWBERRY TRINKET TRAY"
227;11;"RETRO PLASTIC 70'S TRAY"
227;11;"SKULL DESIGN TV DINNER TRAY"
227;11;"RETRO PLASTIC DAISY TRAY"
227;11;"ORANGE TV TRAY TABLE "
227;11;"PETIT TRAY CHIC"
227;11;"LE GRAND TRAY CHIC SET"
227;11;"SNACK TRAY I LOVE LONDON"
227;11;"SNACK TRAY HAPPY FOREST  "
227;11;"SNACK TRAY PAISLEY PARK"
228;11;"MAGIC DRAWING SLATE DINOSAUR"
228;11;"MAGIC DRAWING SLATE BAKE A CAKE "
228;11;"MAGIC DRAWING SLATE CIRCUS PARADE  "
228;11;"MAGIC DRAWING SLATE SPACEBOY "
228;11;"MAGIC DRAWING SLATE GO TO THE FAIR "
228;11;"MAGIC DRAWING SLATE DOLLY GIRL "
228;11;"MAGIC DRAWING SLATE PURDEY"
228;11;"MAGIC DRAWING SLATE LEAP FROG "
228;11;"MAGIC DRAWING SLATE BUNNIES "
229;6;"GOLD FISHING GNOME"
229;6;"GOLD PRINT PAPER BAG"
229;6;"HAND OPEN SHAPE GOLD"
229;6;"SET/6 BEAD COASTERS GAUZE BAG GOLD"
229;6;"GOLD EAR MUFF HEADPHONES"
229;6;"GOLD WASHBAG"
229;6;"GOLD STANDING GNOME"
229;6;"GOLD TEDDY BEAR"
229;6;"GOLD WINE GOBLET"
229;6;"GOLD APERITIF GLASS"
230;6;"damages"
230;6;"damaged stock"
230;6;"damages?"
230;6;"Damaged"
230;6;"POSSIBLE DAMAGES OR LOST?"
230;6;"damaged"
230;6;"DAMAGED"
230;6;"wet damaged"
230;6;"Water damaged"
230;6;"water damage"
230;6;"Damages"
230;6;"damages wax"
230;6;"water damaged"
230;6;"????damages????"
231;7;"RED TOADSTOOL LED NIGHT LIGHT"
231;7;"CHILLI LIGHTS"
231;7;"STAR PORTABLE TABLE LIGHT "
231;7;"SNOWFLAKE PORTABLE TABLE LIGHT "
231;7;"PIG KEYRING WITH LIGHT & SOUND "
231;7;"SUNJAR LED NIGHT NIGHT LIGHT"
231;7;"FLAMINGO LIGHTS"
231;7;"ANTIQUE LILY FAIRY LIGHTS"
231;7;"RABBIT NIGHT LIGHT"
231;7;"LED TEA LIGHTS"
231;7;"TOADSTOOL BEDSIDE LIGHT "
231;7;" TOADSTOOL BEDSIDE LIGHT "
231;7;"PACK OF SIX LED TEA LIGHTS"
231;7;"FAIRY TALE COTTAGE NIGHT LIGHT"
232;7;"LANTERN CREAM GAZEBO "
232;7;"CREAM SLICE FLANNEL CHOCOLATE SPOT "
232;7;"CREAM SLICE FLANNEL PINK SPOT "
232;7;"TURQ ICE CREAM BUM BAG "
232;7;"ANTIQUE CREAM CUTLERY SHELF "
232;7;"ANTIQUE CREAM CUTLERY CUPBOARD"
232;7;"ICE CREAM DESIGN GARDEN PARASOL"
232;7;"ICE CREAM SUNDAE LIP GLOSS"
232;7;"ICE CREAM PEN LIP GLOSS "
232;7;"ICE CREAM BUBBLES"
233;7;"WOODEN OWLS LIGHT GARLAND "
233;7;"TRADITIONAL WOODEN SKIPPING ROPE"
