"node";"cluster";"description"
74;4;"CANDY SPOT HEART DECORATION"
74;4;"DAISY FOLKART HEART DECORATION"
74;4;"MUSICAL ZINC HEART DECORATION "
74;4;"GINGHAM HEART DECORATION"
74;4;"RETROSPOT WOODEN HEART DECORATION"
74;4;"GLITTER HEART DECORATION"
74;4;"BELL HEART DECORATION"
74;4;"JINGLE BELL HEART DECORATION"
74;4;"HEART WREATH DECORATION WITH BELL"
74;4;"DECORATIVE WICKER HEART MEDIUM"
75;4;"ANTIQUE GLASS HEART DECORATION "
76;4;"JINGLE BELL HEART ANTIQUE GOLD"
76;4;"JINGLE BELL HEART ANTIQUE SILVER"
76;4;"LAUREL STAR ANTIQUE SILVER "
76;4;"LAUREL HEART ANTIQUE GOLD"
76;4;"LAUREL HEART ANTIQUE SILVER"
76;4;"BELL HEART ANTIQUE GOLD"
76;4;"LAUREL STAR ANTIQUE GOLD"
76;4;"ANTIQUE HEART SHELF UNIT"
77;4;"BEADED CRYSTAL HEART PINK SMALL"
77;4;"BEADED CRYSTAL HEART GREEN ON STICK"
77;4;"BEADED CRYSTAL HEART PINK ON STICK"
77;4;"BEADED CRYSTAL HEART BLUE SMALL"
77;4;"BEADED CRYSTAL HEART PINK LARGE"
77;4;"BEADED CRYSTAL HEART GREEN SMALL"
77;4;"BEADED CRYSTAL HEART BLUE ON STICK"
77;4;"BEADED CRYSTAL HEART GREEN LARGE"
77;4;"BEADED CRYSTAL HEART BLUE  LARGE"
78;4;"SMALL HEART FLOWERS HOOK "
78;4;"HEART OF WICKER SMALL"
78;4;"SMALL HEART MEASURING SPOONS"
78;4;"HEART IVORY TRELLIS SMALL"
78;4;"HEART FILIGREE DOVE  SMALL"
78;4;"SMALL IVORY HEART WALL ORGANISER"
78;4;"SMALL WHITE HEART OF WICKER"
78;4;"IVORY WICKER HEART SMALL"
78;4;"DECORATIVE WICKER HEART SMALL"
78;4;"PEARLISED IVORY HEART SMALL "
79;4;"SMALL WHITE RETROSPOT MUG IN BOX "
79;4;"SMALL RED RETROSPOT MUG IN BOX "
80;1;"PIGGY BANK RETROSPOT "
80;1;"RECYCLING BAG RETROSPOT "
80;1;"RETROSPOT LAMP"
80;1;"RETROSPOT CIGAR BOX MATCHES "
80;1;"DOORSTOP RETROSPOT HEART"
80;1;"RETROSPOT BABUSHKA DOORSTOP"
80;1;"RECIPE BOX RETROSPOT "
80;1;"CHRISTMAS RETROSPOT ANGEL WOOD"
80;1;"RAIN PONCHO RETROSPOT"
80;1;"BOTTLE BAG RETROSPOT "
81;5;"LUNCH BAG DOLLY GIRL DESIGN"
81;5;"LUNCH BAG SPACEBOY DESIGN "
81;5;"LUNCH BAG WOODLAND"
81;5;"LUNCH BAG SUKI  DESIGN "
81;5;"LUNCH BAG CARS BLUE"
81;5;"LUNCH BAG  BLACK SKULL."
81;5;"LUNCH BAG RED SPOTTY"
81;5;"LUNCH BAG SUKI DESIGN "
81;5;"LUNCH BAG ALPHABET DESIGN"
81;5;"LUNCH BAG APPLE DESIGN"
81;5;"LUNCH BAG VINTAGE LEAF DESIGN"
81;5;"LUNCH BAG DOILEY PATTERN "
81;5;"LUNCH BAG VINTAGE DOILEY "
81;5;"LUNCH BAG VINTAGE DOILY "
81;5;"LUNCH BAG PAISLEY PARK  "
81;5;"LUNCH BAG RED VINTAGE DOILY"
82;5;"JUMBO  BAG BAROQUE BLACK WHITE"
82;5;"JUMBO BAG CHARLIE AND LOLA TOYS"
82;5;"JUMBO STORAGE BAG SUKI"
82;5;"JUMBO BAG OWLS"
82;5;"JUMBO BAG STRAWBERRY"
82;5;"JUMBO STORAGE BAG SKULLS"
82;5;"JUMBO BAG WOODLAND ANIMALS"
82;5;"JUMBO BAG SCANDINAVIAN PAISLEY"
82;5;"JUMBO BAG TOYS "
82;5;"JUMBO BAG SPACEBOY DESIGN"
82;5;"JUMBO BAG SCANDINAVIAN BLUE PAISLEY"
82;5;"JUMBO BAG ALPHABET"
82;5;"JUMBO BAG APPLES"
82;5;"JUMBO BAG PEARS"
82;5;"JUMBO BAG DOILEY PATTERNS"
82;5;"JUMBO BAG 50'S CHRISTMAS "
82;5;"JUMBO BAG PAISLEY PARK"
83;5;"ROSE DU SUD COSMETICS BAG"
83;5;"PINK GREEN EMBROIDERY COSMETIC BAG"
83;5;"BLUE GREEN EMBROIDERY COSMETIC BAG"
83;5;"POCKET BAG PINK PAISELY BROWN SPOT"
83;5;"GOLD COSMETIC BAG PINK STAR"
83;5;"GOLD COSMETICS BAG WITH BUTTERFLY"
84;5;"PINK FLOWER FABRIC PONY"
84;5;"HAND TOWEL PINK FLOWER AND DAISY"
84;5;"TUB 24 PINK FLOWER PEGS"
84;5;"CREAM AND PINK FLOWERS PONY "
84;5;"PAIR OF PINK FLOWER CLUSTER SLIDE"
84;5;"S/4 PINK FLOWER CANDLES IN BOWL"
84;5;"PINK FOXGLOVE ARTIIFCIAL FLOWER"
84;5;"PINK SCOTTIE DOG W FLOWER PATTERN"
84;5;"PINK CANDYSTUFT ARTIFICIAL FLOWER"
84;5;"PINK RETRO BIG FLOWER BAG"
84;5;"PINK ALLIUM  ARTIFICIAL FLOWER"
84;5;"YELLOW PINK FLOWER DESIGN BIG BOWL"
84;5;"VINTAGE KEEPSAKE BOX PINK FLOWER"
86;5;"OLD ROSE COMBO BEAD NECKLACE"
86;5;"BLACK FINE BEAD NECKLACE W TASSEL"
86;5;"TEAL/FUSCHIA COL BEAD NECKLACE"
86;5;"AMBER FINE BEAD NECKLACE W TASSEL"
86;5;"LAZER CUT NECKLACE W PASTEL BEADS"
86;5;"RESIN NECKLACE W PASTEL BEADS"
86;5;"PURPLE FINE BEAD NECKLACE W TASSEL"
87;6;"BLUE MURANO TWIST NECKLACE"
87;6;"PINK MURANO TWIST NECKLACE"
87;6;"GREEN MURANO TWIST NECKLACE"
88;6;"SILVER M.O.P ORBIT DROP EARRINGS"
88;6;"GOLD M.O.P ORBIT DROP EARRINGS"
88;6;"GOLD M.O.P ORBIT BRACELET"
88;6;"SILVER M.O.P ORBIT BRACELET"
88;6;"SILVER M.O.P. ORBIT NECKLACE"
88;6;"GOLD M.O.P. ORBIT NECKLACE"
89;6;"VINTAGE ROSE BEAD BRACELET BLACK"
89;6;"VINTAGE ROSE BEAD BRACELET RASPBERR"
90;4;"ENGLISH ROSE SPIRIT LEVEL "
90;4;"DOORMAT ENGLISH ROSE "
90;4;"ENGLISH ROSE NOTEBOOK A7 SIZE"
90;4;"WRAP ENGLISH ROSE "
90;4;"ENGLISH ROSE GARDEN SECATEURS"
90;4;"ENGLISH ROSE SCENTED HANGING FLOWER"
90;4;"ENGLISH ROSE SMALL SCENTED FLOWER"
90;4;"ENGLISH ROSE METAL WASTE BIN"
90;4;"ENGLISH ROSE NOTEBOOK A6 SIZE"
90;4;"TRIPLE HOOK ANTIQUE IVORY ROSE"
90;4;"SINGLE ANTIQUE ROSE HOOK IVORY"
90;4;"MINIATURE ANTIQUE ROSE HOOK IVORY"
90;4;"MINITURE ANTIQUE ROSE HOOK IVORY"
90;4;"ENGLISH ROSE SCENTED HANGING HEART"
91;4;"ROSE CARAVAN DOORSTOP"
91;4;"ROSES REGENCY TEACUP AND SAUCER "
91;4;"ROSE DU SUD DRAWSTRING BAG"
91;4;"ROSE DU SUD OVEN GLOVE"
91;4;"ROSE DU SUD WASHBAG "
91;4;"DANISH ROSE TRINKET TRAYS"
91;4;"DANISH ROSE DELUXE COASTER"
91;4;"DANISH ROSE BEDSIDE CABINET"
91;4;"DANISH ROSE FOLDING CHAIR"
91;4;"DANISH ROSE DECORATIVE PLATE"
91;4;"REGENCY TEAPOT ROSES "
91;4;"REGENCY TEA PLATE ROSES "
91;4;"DANISH ROSE UMBRELLA STAND"
92;4;"GAOLERS KEYS DECORATIVE GARDEN "
92;4;"MINI PAINTED GARDEN DECORATION "
92;4;"DECORATION  PINK CHICK MAGIC GARDEN"
92;4;"DECORATION  BUTTERFLY  MAGIC GARDEN"
92;4;"BIRDHOUSE DECORATION MAGIC GARDEN"
92;4;"MINI  ZINC GARDEN DECORATIONS "
92;4;"DECORATION WHITE CHICK MAGIC GARDEN"
92;4;"BUNNY DECORATION MAGIC GARDEN"
93;4;"STAR DECORATION PAINTED ZINC "
93;4;"ANGEL DECORATION STARS ON DRESS"
93;4;"STAR DECORATION RUSTIC"
93;4;"DOVE DECORATION PAINTED ZINC "
93;4;"PAINTED LIGHTBULB STAR+ MOON"
93;4;"ANGEL DECORATION PAINTED ZINC "
93;4;"SILVER STARS TABLE DECORATION"
94;1;"FIVE HEART HANGING DECORATION"
94;1;"HANGING HEART MIRROR DECORATION "
94;1;"HEART DECORATION RUSTIC HANGING "
94;1;"IVORY HANGING DECORATION  HEART"
94;1;"3 HEARTS HANGING DECORATION RUSTIC"
94;1;"CANDY HEART HANGING DECORATION"
95;1;"HANGING METAL HEART LANTERN"
95;1;"BLUE FELT HANGING HEART W FLOWER"
95;1;"PINK FELT HANGING HEART W FLOWER"
95;1;"HEART STRING MEMO HOLDER HANGING"
95;1;"HANGING WOOD AND FELT HEART"
95;1;"YELLOW FELT HANGING HEART W FLOWER"
95;1;"HANGING HEART BASKET"
95;1;"HANGING HEART WITH BELL"
95;1;"HANGING ENGRAVED METAL HEART"
95;1;"BLUE FELT HANGING HEART WITH FLOWER"
95;1;"NATURAL HANGING QUILTED HEARTS "
95;1;"PRETTY HANGING QUILTED HEARTS"
95;1;"HANGING HEART BONHEUR"
96;4;"CANDLEHOLDER PINK HANGING HEART"
96;4;"PINK HEARTS PAPER GARLAND"
96;4;"BLUE PATCH PURSE PINK HEART"
96;4;"PINK METAL CHICKEN HEART "
96;4;"ROUND PINK HEART MIRROR"
96;4;"PINK HEARTS LIGHT CHAIN "
96;4;"BLUE CAT BISCUIT BARREL PINK HEART"
97;4;"TRIPLE WIRE HOOK IVORY HEART"
97;4;"TRIPLE WIRE HOOK PINK HEART"
97;4;"SINGLE WIRE HOOK PINK HEART"
97;4;"SINGLE WIRE HOOK IVORY HEART"
99;1;"MEMO BOARD RETROSPOT  DESIGN"
99;1;"MEMO BOARD COTTAGE DESIGN"
100;1;"WRAP, BILLBOARD FONTS DESIGN"
100;1;"WRAP DOILEY DESIGN"
100;1;"WRAP ALPHABET DESIGN"
100;1;"WRAP POPPIES  DESIGN"
100;1;"WRAP VINTAGE PETALS  DESIGN"
100;1;"WRAP BILLBOARD FONTS DESIGN"
100;1;"WRAP SUMMER ROSE DESIGN"
101;5;"CHARLOTTE BAG DOLLY GIRL DESIGN"
101;5;"JUMBO BAG DOLLY GIRL DESIGN"
101;5;"CHARLOTTE BAG SUKI DESIGN"
101;5;"PEG BAG APPLES DESIGN"
101;5;"PEG BAG APPLE DESIGN"
101;5;"CHARLOTTE BAG APPLES DESIGN"
101;5;"CHARLOTTE BAG ALPHABET  DESIGN"
102;5;"STRAWBERRY CHARLOTTE BAG"
102;5;"STRAWBERRY SHOPPER BAG"
102;5;"PINK PARTY BAGS"
102;5;"BLUE PARTY BAGS "
102;5;"WOODLAND CHARLOTTE BAG"
102;5;"CHARLIE AND LOLA CHARLOTTE BAG"
102;5;"STRAWBERRY   PICNIC BAG"
102;5;"PARTY FOOD SHOPPER BAG"
102;5;"POSY CANDY BAG"
102;5;"BOYS PARTY BAG"
102;5;"GIRLS PARTY BAG"
103;5;"SKULL SHOULDER BAG"
103;5;"SUKI  SHOULDER BAG"
103;5;"RED FLORAL FELTCRAFT SHOULDER BAG"
103;5;"PINK FLORAL FELTCRAFT SHOULDER BAG"
103;5;"GREY FLORAL FELTCRAFT SHOULDER BAG"
103;5;"BLUE STRIPES SHOULDER BAG"
103;5;"HAYNES CAMPER SHOULDER BAG"
104;5;"S/6 SEW ON CROCHET FLOWERS"
104;5;"BASKET OF FLOWERS SEWING KIT"
104;5;"PINK/YELLOW FLOWERS HANDBAG"
104;5;"YELLOW FLOWERS FELT HANDBAG KIT"
104;5;"PURPLE/TURQ FLOWERS HANDBAG"
104;5;"ORANGE FELT VASE + FLOWERS"
104;5;"FLOWERS HANDBAG blue and orange"
105;5;"SET/4 BLUE FLOWER CANDLES IN BOWL"
105;5;"HAND TOWEL PALE BLUE W FLOWERS"
105;5;"BLUE SCOTTIE DOG W FLOWER PATTERN"
105;5;"BLUE FLOWER DES PURSE"
105;5;"BLUE TABLE RUN FLOWER"
105;5;"BLUE DELPHINIUM ARTIFICIAL FLOWER"
105;5;"ANTIQUE MID BLUE FLOWER EARRINGS"
105;5;"FLOWER BLUE CLOCK WITH SUCKER"
105;5;"BLUE CLIMBING HYDRANGA ART FLOWER"
106;5;"COPPER/OLIVE GREEN FLOWER NECKLACE"
106;5;"MIDNIGHT BLUE COPPER FLOWER NECKLAC"
106;5;"LONG SILVER NECKLACE PASTEL FLOWER"
106;5;"RASPBERRY ANT COPPER FLOWER NECKLAC"
106;5;"FLOWER GARLAND NECKLACE RED"
107;5;"NEW BAROQUE B'FLY NECKLACE GREEN"
107;5;"NEW BAROQUE LARGE NECKLACE BLK/WHIT"
107;5;"NEW BAROQUE B'FLY NECKLACE MONTANA"
107;5;"NEW BAROQUE B'FLY NECKLACE CRYSTAL"
107;5;"NEW BAROQUE SMALL NECKLACE BLACK"
107;5;"NEW BAROQUE B'FLY NECKLACE RED"
107;5;"NEW BAROQUE B'FLY NECKLACE PINK"
108;6;"AMETHYST GLASS/SHELL/PEARL NECKLACE"
108;6;"BLACK+WHITE NECKLACE W TASSEL"
108;6;"AMBER CHUNKY GLASS+BEAD NECKLACE"
108;6;"PURPLE GEMSTONE NECKLACE 45CM"
108;6;"SILVER/NATURAL SHELL NECKLACE"
108;6;"GOLD M PEARL  ORBIT NECKLACE"
108;6;"LIGHT TOPAZ TEAL/AQUA COL NECKLACE"
108;6;"PINK SWEETIE NECKLACE"
108;6;"ST TROPEZ NECKLACE"
108;6;"RED KUKUI COCONUT SEED NECKLACE"
108;6;"BROWN KUKUI COCONUT SEED NECKLACE"
108;6;"CHUNKY SILVER NECKLACE PASTEL FLOWE"
108;6;"BILI NUT AND WOOD NECKLACE"
108;6;"FINE SILVER NECKLACE W PASTEL FLOWE"
108;6;"PALE PINK/AMETHYST STONE NECKLACE"
108;6;"SILVER/MOP ORBIT NECKLACE"
108;6;"PURPLE CHUNKY GLASS+BEAD NECKLACE"
108;6;"DIAMANTE NECKLACE BLACK "
108;6;"PURPLE FRANGIPANI NECKLACE"
108;6;"PINK ROSEBUD & PEARL NECKLACE"
108;6;"AMBER GLASS/SHELL/PEARL NECKLACE"
108;6;"GOLD/M.O.P PENDANT ORBIT NECKLACE"
108;6;"SILVER/M.O.P PENDANT ORBIT NECKLACE"
108;6;"PURPLE AMETHYST NECKLACE W TASSEL"
108;6;"ORANGE/WHT/FUSCHIA STONES NECKLACE"
108;6;"RIVIERA NECKLACE"
108;6;"DIAMANTE NECKLACE"
108;6;"SILVER/BLACK PENDANT ORBIT NECKLACE"
108;6;"PINK/AMETHYST/GOLD NECKLACE"
108;6;"SILVER/BLACK ORBIT NECKLACE"
108;6;"BLACK GLASS/SHELL/PEARL NECKLACE"
108;6;"ORANGE/FUSCHIA STONES NECKLACE"
108;6;"COTE D'AZURE NECKLACE"
108;6;"LASER CUT MULTI STRAND NECKLACE"
108;6;"SILVER FLOWR PINK SHELL NECKLACE"
108;6;"DIAMANTE NECKLACE PURPLE"
108;6;"DIAMANTE NECKLACE GREEN"
109;6;"GREEN PENDANT TRIPLE SHELL NECKLACE"
109;6;"BLUE/GREEN SHELL NECKLACE W PENDANT"
109;6;"IVORY PENDANT TRIPLE SHELL NECKLACE"
109;6;"TURQ PENDANT TRIPLE SHELL NECKLACE"
109;6;"GREEN PENDANT SHELL NECKLACE"
109;6;"MOP PENDANT SHELL NECKLACE"
109;6;"SILVER/NAT SHELL NECKLACE W PENDANT"
109;6;"ROSE PENDANT TRIPLE SHELL NECKLACE"
109;6;"BLUE/NAT SHELL NECKLACE W PENDANT"
109;6;"ORANGE PENDANT TRIPLE SHELL NECKLAC"
110;6;"CROCHET ROSE PURSE WITH SUEDE BACK"
110;6;"CROCHET ROSE DES CLOTHES HANGER"
111;4;"CLASSICAL ROSE SMALL VASE"
111;4;"PORCELAIN ROSE LARGE "
111;4;"PORCELAIN ROSE SMALL"
111;4;"CLASSICAL ROSE CANDLESTAND"
111;4;"CLASSICAL ROSE TABLE LAMP"
112;4;"RUSTIC STRAWBERRY JAMPOT LARGE "
112;4;"RUSTIC STRAWBERRY JAMPOT SMALL"
112;4;"RUSTIC STRAWBERRY JAM POT SMALL"
112;4;"RUSTIC STRAWBERRY JAM POT LARGE "
113;4;"DECORATIVE PLANT POT WITH FRIEZE"
113;4;"DECORATIVE ROSE BATHROOM BOTTLE"
113;4;"DECORATIVE CATS BATHROOM BOTTLE"
113;4;"ANGEL DECORATION 3 BUTTONS "
113;4;"METAL DECORATION NAUGHTY CHILDREN "
113;4;"CHERRY BLOSSOM  DECORATIVE FLASK"
113;4;"DECORATIVE FLORE BATHROOM BOTTLE"
113;4;"HEN HOUSE DECORATION"
113;4;"BIRDCAGE DECORATION TEALIGHT HOLDER"
113;4;"ANGEL DECORATION WITH LACE PADDED"
113;4;"DECORATION , WOBBLY RABBIT , METAL "
113;4;"DECORATION , WOBBLY CHICKEN, METAL "
113;4;"HIPPY CHIC DECORATIVE PARASOL"
113;4;"SUNFLOWER DECORATIVE PARASOL"
113;4;"WHITE/PINK CHICK DECORATION"
113;4;"CHERRY BLOSSOM DECORATIVE FLASK"
113;4;"DECORATION WOBBLY RABBIT METAL "
113;4;"DECORATION WOBBLY CHICKEN"
113;4;"DECORATION SITTING BUNNY"
113;4;"LIGHT DECORATION BATTERY OPERATED"
114;4;"LOVEBIRD HANGING DECORATION WHITE "
114;4;"FIVE CATS HANGING DECORATION"
114;4;"DECORATION HEN ON NEST, HANGING"
114;4;"HANGING CHICK  YELLOW DECORATION"
114;4;"HANGING METAL RABBIT DECORATION"
114;4;"HANGING FAIRY CAKE DECORATION"
114;4;"IVORY HANGING DECORATION  BIRD"
114;4;"HANGING CHICK GREEN DECORATION"
114;4;"PINK POODLE HANGING DECORATION "
114;4;"HANGING CHICK CREAM DECORATION"
114;4;"HANGING METAL CHICKEN DECORATION"
114;4;"HAPPY EASTER HANGING DECORATION"
114;4;"IVORY HANGING DECORATION  EGG"
114;4;"HANGING HEN ON NEST DECORATION"
114;4;"DECORATIVE HANGING SHELVING UNIT"
115;1;"HANGING MEDINA LANTERN SMALL"
115;1;"HANGING METAL STAR LANTERN"
115;1;"SLATE TILE NATURAL HANGING"
115;1;"LARGE HANGING IVORY & RED WOOD BIRD"
115;1;"SMALL HANGING IVORY/RED WOOD BIRD"
115;1;"PORCELAIN HANGING BELL SMALL"
115;1;"SMALL HANGING GLASS+ZINC LANTERN"
115;1;"HANGING WOOD AND FELT BUTTERFLY "
115;1;"GLITTER HANGING BUTTERFLY STRING"
115;1;"HANGING WOOD AND FELT FLOWER"
115;1;"FOLK FELT HANGING MULTICOL GARLAND"
115;1;"HANGING SPRING FLOWER EGG LARGE"
115;1;"ACRYLIC HANGING JEWEL,BLUE"
115;1;"HANGING SPRING FLOWER EGG SMALL"
115;1;"HANGING BUTTERFLY  EGG"
115;1;"PURPLE/COPPER HANGING LAMPSHADE"
115;1;"IVORY PANTRY HANGING LAMP "
115;1;"IVORY CAFE HANGING LAMP "
115;1;"HANGING CLEAR MINI BOTTLE"
115;1;"HANGING MINI COLOURED BOTTLES"
115;1;"HANGING QUILTED PATCHWORK APPLES"
115;1;"CHRISTMAS HANGING SNOWFLAKE"
115;1;"ACRYLIC HANGING JEWEL,PINK"
117;1;"CREAM HEART CARD HOLDER"
117;1;"BLACK HEART CARD HOLDER"
117;1;"CARD HOLDER GINGHAM HEART"
117;1;"3 BLACK CATS W HEARTS BLANK CARD"
118;1;"FANCY FONT BIRTHDAY CARD, "
118;1;"CARD BIRTHDAY COWBOY"
118;1;"RAINY LADIES BIRTHDAY CARD"
118;1;"TOAST ITS - HAPPY BIRTHDAY"
118;1;"BIRTHDAY CARD, RETRO SPOT"
118;1;"ROBOT BIRTHDAY CARD"
118;1;"ELEPHANT, BIRTHDAY CARD, "
118;1;"COWBOYS AND INDIANS BIRTHDAY CARD "
118;1;"RING OF ROSES BIRTHDAY CARD"
118;1;"SPACEBOY BIRTHDAY CARD"
118;1;"EMPIRE BIRTHDAY CARD"
118;1;"TEA PARTY BIRTHDAY CARD"
118;1;"PENNY FARTHING BIRTHDAY CARD"
118;1;"BOTANICAL LAVENDER BIRTHDAY CARD"
118;1;"CARD SUKI BIRTHDAY"
118;1;"BANQUET BIRTHDAY  CARD  "
118;1;"HAPPY BIRTHDAY CARD STRIPEY TEDDY"
118;1;"HAPPY BIRTHDAY CARD TEDDY/CAKE"
118;1;"ELEPHANT BIRTHDAY CARD "
119;1;"DOG BOWL CHASING BALL DESIGN"
119;1;"CALENDAR PAPER CUT DESIGN"
119;1;"CALENDAR IN SEASON DESIGN"
119;1;"SKULLS DESIGN FLANNEL"
119;1;"KITTENS DESIGN FLANNEL"
119;1;"ASSTD DESIGN RACING CAR PEN"
119;1;"CAMOUFLAGE DESIGN TEDDY"
119;1;"OVEN MITT APPLES DESIGN"
119;1;"CAROUSEL DESIGN WASHBAG"
119;1;"WORLD WAR 2 GLIDERS ASSTD DESIGNS"
119;1;"ASSTD DESIGN 3D PAPER STICKERS"
119;1;"STRAWBERRIES  DESIGN FLANNEL "
119;1;"ASSTD DESIGN BUBBLE GUM RING"
119;1;"BLUE CIRCLES DESIGN MONKEY DOLL"
119;1;"STRIPES DESIGN TEDDY"
119;1;"BLUE CIRCLES DESIGN TEDDY"
119;1;"SUMMER FUN DESIGN SHOWER CAP"
119;1;"STRIPY DESIGN SHOWER CAP"
119;1;"CAKES AND RABBITS DESIGN FLANNEL "
119;1;"PAINTED LIGHTBULB RAINBOW DESIGN"
119;1;"DOORSTOP FOOTBALL DESIGN"
119;1;"DOORSTOP RACING CAR DESIGN"
119;1;"EMPIRE DESIGN ROSETTE"
119;1;"BEACH HUT DESIGN BLACKBOARD"
119;1;"PARTY TIME DESIGN FLANNEL"
119;1;"STRIPES DESIGN MONKEY DOLL"
119;1;"SCOTTIES DESIGN WASHBAG"
119;1;"COTTON APRON PANTRY DESIGN"
119;1;"YELLOW/ORANGE FLOWER DESIGN PLATE"
119;1;"KNEELING MAT HOUSEWORK  DESIGN"
120;1;"RED TEA TOWEL CLASSIC DESIGN"
120;1;"BLACK TEA TOWEL CLASSIC DESIGN"
120;1;"BLUE TEA TOWEL CLASSIC DESIGN"
120;1;"SET 2 PANTRY DESIGN TEA TOWELS"
121;5;"TOTE BAG I LOVE LONDON"
121;5;"S/6 WOODEN SKITTLES IN COTTON BAG"
121;5;"SAVE THE PLANET COTTON TOTE BAG"
121;5;"LOLITA  DESIGN  COTTON TOTE BAG"
121;5;"LETS GO SHOPPING COTTON TOTE BAG"
121;5;"WOODLAND DESIGN  COTTON TOTE BAG"
121;5;"SKULLS  DESIGN  COTTON TOTE BAG"
121;5;"RABBIT  DESIGN  COTTON TOTE BAG"
122;5;"BAG 500g SWIRLY MARBLES"
122;5;"SWIRLY CIRCULAR RUBBERS IN BAG"
122;5;"BAG 125g SWIRLY MARBLES"
122;5;"BAG 250g SWIRLY MARBLES"
123;5;"TEATIME FUNKY FLOWER BACKPACK FOR 2"
123;5;"SET/12 FUNKY FELT FLOWER PEG IN BAG"
123;5;"FUNKY FLOWER PICNIC BAG FOR 4"
124;5;"FLOWER FAIRY,5 SUMMER B'DRAW LINERS"
124;5;"FLOWER FAIRY 5 DRAWER LINERS"
124;5;"FLOWER FAIRY 5 SUMMER DRAW LINERS"
125;5;"KITCHEN FLOWER POTS WALL PLAQUE"
125;5;"CD WALL TIDY RED FLOWERS"
125;5;"SMALL KITCHEN FLOWER POTS PLAQUE"
125;5;"A4 WALL TIDY RED FLOWERS"
126;5;"BLACK VINT ART DEC CRYSTAL NECKLACE"
126;5;"BLACK VINT ART DEC CRYSTAL BRACELET"
127;6;"DIAMOND LAS VEGAS NECKLACE 45CM"
127;6;"BLACK GEMSTONE NECKLACE 45CM"
127;6;"JET BLACK LAS VEGAS BRACELET ROUND"
127;6;"JET BLACK LAS VEGAS NECKLACE 45CM"
128;6;"WHITE/PINK MINI CRYSTALS NECKLACE"
128;6;"BLACK DROP CRYSTAL NECKLACE"
128;6;"MIDNIGHT BLUE DROP CRYSTAL NECKLACE"
128;6;"PINK COMBO MINI CRYSTALS NECKLACE"
128;6;"VINTAGE ENAMEL & CRYSTAL NECKLACE"
129;6;"CLAM SHELL LARGE"
129;6;"COCKLE SHELL DISH"
129;6;"PEARL & SHELL 42""NECKL. GREEN"
129;6;"PEARL & SHELL 42""NECKL. IVORY"
130;6;"RETROSPOT LARGE MILK JUG"
130;6;"LARGE CHINESE STYLE SCISSOR"
130;6;"PICNIC BASKET WICKER LARGE"
130;6;"LARGE ROUND WICKER PLATTER "
130;6;"LARGE RED BABUSHKA NOTEBOOK "
130;6;"LARGE PURPLE BABUSHKA NOTEBOOK  "
130;6;"WICKER WREATH LARGE"
130;6;"LARGE YELLOW BABUSHKA NOTEBOOK "
130;6;"LARGE TAHITI BEACH BAG"
130;6;"NATURAL SLATE CHALKBOARD LARGE "
130;6;"LARGE MINT DIAMANTE HAIRSLIDE"
130;6;"DAIRY MAID LARGE MILK JUG"
130;6;"LARGE SKULL WINDMILL"
130;6;"FELT TOADSTOOL LARGE"
130;6;"ASS COL LARGE SAND FROG P'WEIGHT"
130;6;"LARGE ROUND CUTGLASS CANDLESTICK"
130;6;"LARGE CRYSTAL DIAMANTE HAIRSLIDE"
130;6;"LARGE DECO JEWELLERY STAND"
130;6;"LARGE JEWELLERY STAND"
130;6;"LARGE BLACK DIAMANTE HAIRSLIDE"
131;6;"MEDIUM CERAMIC TOP STORAGE JAR"
131;6;"SMALL CERAMIC TOP STORAGE JAR "
131;6;"LARGE CERAMIC TOP STORAGE JAR"
131;6;"SMALL APOTHECARY MEASURING JAR "
131;6;"APOTHECARY MEASURING JAR"
131;6;"LARGE APOTHECARY MEASURING JAR "
132;4;"CAKE STAND VICTORIAN FILIGREE MED"
132;4;"CAKE STAND VICTORIAN FILIGREE SMALL"
132;4;"LARGE CAKE TOWEL, CHOCOLATE SPOTS"
132;4;"LARGE CAKE TOWEL PINK SPOTS"
132;4;"CAKE STAND VICTORIAN FILIGREE LARGE"
132;4;"LARGE CAKE TOWEL CHOCOLATE SPOTS"
133;7;"REGENCY CAKE FORK"
133;7;"REGENCY CAKE SLICE"
134;7;"AMETHYST HOOP EARRING FLORAL LEAF"
134;7;"CRYSTAL HOOP EARRING FLORAL LEAF"
136;1;"3D DOG PICTURE PLAYING CARDS"
136;1;"PLAYING CARDS KEEP CALM & CARRY ON"
136;1;"PLAYING CARDS JUBILEE UNION JACK"
136;1;"MINI PLAYING CARDS SPACEBOY "
136;1;"PLAYING CARDS VINTAGE DOILEY "
136;1;"PLAYING CARDS I LOVE LONDON "
136;1;"MINI PLAYING CARDS GYMKHANA"
136;1;"MINI PLAYING CARDS DOLLY GIRL "
136;1;"MINI PLAYING CARDS FUN FAIR "
136;1;"MINI PLAYING CARDS BUFFALO BILL "
136;1;"PLAYING CARDS VINTAGE DOILY "
137;1;"GIN & TONIC DIET GREETING CARD "
137;1;"BOOZE & WOMEN GREETING CARD "
137;1;"SWALLOWS GREETING CARD"
137;1;"BANK ACCOUNT  GREETING  CARD "
137;1;"SKULLS GREETING CARD"
137;1;"VINTAGE CARAVAN GREETING CARD "
137;1;"GREETING CARD, STICKY GORDON"
137;1;"GREETING CARD, OVERCROWDED POOL."
137;1;"FAWN AND MUSHROOM GREETING CARD"
137;1;"BOTANICAL ROSE GREETING CARD"
137;1;"BOTANICAL LILY GREETING CARD"
137;1;"GREETING CARD, TWO SISTERS."
138;1;"VINTAGE HEADS AND TAILS CARD GAME "
138;1;"CARD CIRCUS PARADE"
138;1;"RED STAR CARD HOLDER"
138;1;"VINTAGE SNAP CARDS"
138;1;"MAKE YOUR OWN MONSOON CARD KIT"
138;1;"MAKE YOUR OWN PLAYTIME CARD KIT"
138;1;"CARD I LOVE LONDON "
138;1;"CARD BILLBOARD FONT"
138;1;"CARD PSYCHEDELIC APPLES"
138;1;"MAKE YOUR OWN FLOWERPOWER CARD KIT"
138;1;"STRING OF STARS CARD HOLDER"
138;1;"CARD PARTY GAMES "
138;1;"CHRISTMAS CARD SCREEN PRINT "
138;1;"CARD MOTORBIKE SANTA"
138;1;"CARD CHRISTMAS VILLAGE"
138;1;"CHRISTMAS CARD STACK OF PRESENTS"
138;1;"CARD CAT AND TREE "
138;1;"CARD DOG AND BALL "
138;1;"VINTAGE KID DOLLY CARD "
138;1;"CHRISTMAS CARD SINGING ANGEL"
138;1;"DECOUPAGE,GREETING CARD,"
138;1;"ROBIN CHRISTMAS CARD"
138;1;"CARD GINGHAM ROSE "
138;1;"CARD WEDDING DAY"
138;1;"PACK/12 XMAS FUN CARD"
138;1;"CHAMPAGNE TRAY BLANK CARD"
138;1;"CARD HOLDER LOVE BIRD SMALL"
138;1;"CARD HOLDER LOVE BIRD LARGE "
138;1;"DOILY THANK YOU CARD"
138;1;"A PRETTY THANK YOU CARD"
138;1;"PAISLEY PARK CARD"
138;1;"CAT WITH SUNGLASSES BLANK CARD"
139;1;"HAND WARMER SCOTTY DOG DESIGN"
139;1;"HAND WARMER OWL DESIGN"
139;1;"HAND WARMER BIRD DESIGN"
139;1;"HAND WARMER BABUSHKA DESIGN"
139;1;"HI TEC ALPINE HAND WARMER"
140;1;"CERAMIC CHERRY CAKE MONEY BANK"
140;1;"CERAMIC STRAWBERRY CAKE MONEY BANK"
140;1;"CERAMIC STRAWBERRY MONEY BOX"
140;1;"CERAMIC HEART FAIRY CAKE MONEY BANK"
140;1;"CERAMIC PIRATE CHEST MONEY BANK"
140;1;"CERAMIC STRAWBERRY DESIGN MUG"
140;1;"CERAMIC CAKE DESIGN SPOTTED MUG"
140;1;"CERAMIC CAKE DESIGN SPOTTED PLATE"
140;1;"CERAMIC PLATE STRAWBERRY DESIGN"
140;1;"CERAMIC BOWL WITH STRAWBERRY DESIGN"
140;1;"CERAMIC LOVE HEART MONEY BANK"
141;5;"LILAC DIAMANTE PEN IN GIFT BOX"
141;5;"BLUE  DIAMANTE PEN IN GIFT BOX"
141;5;"PINK DIAMANTE PEN IN GIFT BOX"
141;5;"SILVER DIAMANTE PEN IN GIFT BOX"
141;5;"GREEN  DIAMANTE PEN IN GIFT BOX"
142;5;"SMALL STRIPES CHOCOLATE GIFT BAG "
142;5;"FUNKY MONKEY GIFT BAG MEDIUM"
142;5;"GIFT BAG PSYCHEDELIC APPLES"
142;5;"SMALL POLKADOT CHOCOLATE GIFT BAG "
142;5;"LARGE STRIPES CHOCOLATE GIFT BAG"
142;5;"GIFT BAG BIRTHDAY"
142;5;"THE KING GIFT BAG"
142;5;"THE KING GIFT BAG 25x24x12cm"
142;5;"VINTAGE CHRISTMAS PAPER GIFT BAG"
142;5;"GIFT BAG LARGE VINTAGE CHRISTMAS"
142;5;"RED SPOT PAPER GIFT BAG"
142;5;" RED SPOT GIFT BAG LARGE"
142;5;"GIFT BAG LARGE SPOT "
142;5;"VINTAGE CHRISTMAS GIFT BAG LARGE "
142;5;"50'S CHRISTMAS PAPER GIFT BAG"
142;5;" 50'S CHRISTMAS GIFT BAG LARGE"
142;5;"GIFT BAG LARGE 50'S CHRISTMAS"
143;5;"RED GLASS TASSLE BAG CHARM"
143;5;"PINK GLASS TASSLE BAG CHARM "
143;5;"TURQUOISE GLASS TASSLE BAG CHARM "
143;5;"GREEN GLASS TASSLE BAG CHARM"
143;5;"AMBER GLASS TASSLE BAG CHARM"
143;5;"PURPLE GLASS TASSLE BAG CHARM"
143;5;"AQUA BERTIE GLASS BEAD BAG CHARM"
143;5;"PURPLE BERTIE GLASS BEAD BAG CHARM"
143;5;"PINK BERTIE GLASS BEAD BAG CHARM"
143;5;"AMBER BERTIE GLASS BEAD BAG CHARM"
143;5;"TURQUOISE BERTIE GLASS BEAD CHARM"
144;5;"FLOWER GLASS GARLD NECKL36""TURQUOIS"
144;5;"FLOWER GLASS GARLAND NECKL.36""BLACK"
144;5;"FLOWER GLASS GARLD NECKL36""AMETHYST"
144;5;"CITRUS GARLAND FELT FLOWERS "
144;5;"FLOWER GLASS GARLAND NECKL.36""BLUE"
144;5;"FLOWER GLASS GARLAND NECKL.36""GREEN"
145;5;"FLOWERS  STICKERS"
145;5;"TOAST ITS - FAIRY FLOWER"
145;5;"MAGIC TREE -PAPER FLOWERS"
145;5;"FUSCHIA FLOWER PURSE WITH BEADS"
145;5;"SILVER GLITTER FLOWER VOTIVE HOLDER"
145;5;"SILVER HOOP EARRINGS WITH FLOWER"
145;5;"SILVER BRACELET W PASTEL FLOWER"
145;5;"FLOWER FAIRY INCENSE BOUQUET"
145;5;"ANTIQUE OLIVE GREEN FLOWER EARRINGS"
145;5;"ANTIQUE OPAL WHITE FLOWER EARRINGS"
145;5;"SET/4 SPRING FLOWER DECORATION"
145;5;"FLOWER PURPLE CLOCK W/SUCKER"
145;5;"SPRIG LAVENDER ARTIFICIAL FLOWER"
145;5;"CREAM DELPHINIUM ARTIFICIAL FLOWER"
145;5;"WHITE ANEMONE ARTIFICIAL FLOWER"
145;5;"SET/3 RABBITS FLOWER SKIPPPING ROPE"
145;5;"FLOWERS TILE COASTER"
145;5;"COLOURFUL FLOWER FRUIT BOWL"
145;5;"WHITE CANDYSTUFT ARTIFICIAL FLOWER"
145;5;"PURPLE FOXGLOVE ARTIIFCIAL FLOWER"
145;5;"FUSCHIA TABLE RUN FLOWER "
145;5;"ANTIQUE RASPBERRY FLOWER EARRINGS"
145;5;"PURPLE ANEMONE ARTIFICIAL FLOWER"
145;5;"WHITE ALLIUM  ARTIFICIAL FLOWER"
145;5;"FLOWER PURPLE CLOCK WITH SUCKER"
145;5;"ROSE FLOWER CANDLE+INCENSE 16X16CM"
146;6;"BALLOON ART MAKE YOUR OWN FLOWERS"
146;6;"WHITE CHRYSANTHEMUMS ART FLOWER"
146;6;"LARGE WHITE/PINK ROSE ART FLOWER"
146;6;"MEDIUM WHITE/PINK ROSE ART FLOWER"
146;6;"PINK HYDRANGEA ART FLOWER"
146;6;"SMALL WHITE/PINK ROSE ART FLOWER"
146;6;"WHITE HYDRANGEA ART FLOWER"
146;6;"CREAM CLIMBING HYDRANGA ART FLOWER"
146;6;"PINK CHRYSANTHEMUMS ART FLOWER"
147;6;"WHITE FRANGIPANI NECKLACE"
147;6;"WHITE SILVER NECKLACE SHELL GLASS"
147;6;"WHITE ROSEBUD & PEARL NECKLACE"
147;6;"WHITE VINT ART DECO CRYSTAL NECKLAC"
147;6;"SPOTTED WHITE NATURAL SEED NECKLACE"
148;6;"WOODEN PICTURE FRAME WHITE FINISH"
148;6;"WOODEN FRAME ANTIQUE WHITE "
148;6;"CLASSIC WHITE FRAME"
148;6;"FAMILY ALBUM WHITE PICTURE FRAME"
148;6;"LARGE ANTIQUE WHITE PHOTO FRAME"
149;6;"PANDA AND BUNNIES STICKER SHEET"
149;6;"PAISLEY PATTERN  STICKERS"
149;6;"3D CHRISTMAS STAMPS STICKERS "
149;6;"WOODLAND  HEIGHT CHART STICKERS "
149;6;"CANDY SHOP  STICKER SHEET"
149;6;"SWEET PUDDING STICKER SHEET"
149;6;"3D SHEET OF DOG STICKERS"
149;6;"3D SHEET OF CAT STICKERS"
149;6;"LOVELY BONBON STICKER SHEET"
149;6;"3D TRADITIONAL CHRISTMAS STICKERS"
149;6;"FOOD/DRINK SPONGE STICKERS"
149;6;"BUTTERFLIES STICKERS"
149;6;"SWEETIES  STICKERS"
149;6;"ASS DES PHONE SPONGE CRAFT STICKER"
149;6;"ANIMAL STICKERS"
149;6;"ALPHABET HEARTS STICKER SHEET"
149;6;"CAKE SHOP  STICKER SHEET"
149;6;"WOODLAND  STICKERS"
150;6;"SMALL CAMPHOR WOOD FIELD  MUSHROOM"
150;6;"CAMPHOR WOOD PORTOBELLO MUSHROOM"
150;6;"LARGE CAMPHOR WOOD FIELD MUSHROOM "
150;6;"LARGE  TALL CAMPHOR WOOD TOADSTOOL "
150;6;"SMALL TALL CAMPHOR WOOD TOADSTOOL"
151;6;"JOY LARGE WOOD LETTERS"
151;6;"LOVE LARGE WOOD LETTERS "
151;6;"WOODLAND STORAGE BOX LARGE "
151;6;"RELAX LARGE WOOD LETTERS"
151;6;"SKULLS STORAGE BOX LARGE"
153;7;"DOORMAT FAIRY CAKE"
153;7;"FAIRY CAKE BIRTHDAY CANDLE SET"
153;7;"FAIRY CAKE NOTEBOOK A5 SIZE"
153;7;"FAIRY CAKES NOTEBOOK A6 SIZE"
153;7;"FAIRY CAKES NOTEBOOK A7 SIZE"
153;7;"STRAWBERRY FAIRY CAKE TEAPOT"
153;7;"FAIRY CAKE DESIGN UMBRELLA"
154;7;"BLACK DIAMOND CLUSTER EARRINGS"
154;7;"BLACK DIAMOND CLUSTER NECKLACE"
154;7;"MONTANA DIAMOND CLUSTER EARRINGS"
154;7;"MONTANA DIAMOND CLUSTER NECKLACE"
155;7;"EDWARDIAN DROP EARRINGS JET BLACK"
155;7;"SILVER/AMETHYST DROP EARRINGS LEAF"
155;7;"DROP DIAMANTE EARRINGS CRYSTAL"
155;7;"DROP DIAMANTE EARRINGS GREEN"
155;7;"JADE DROP EARRINGS W FILIGREE"
155;7;"AMBER DROP EARRINGS W LONG BEADS"
155;7;"AMETHYST DROP EARRINGS W LONG BEADS"
155;7;"DROP DIAMANTE EARRINGS PURPLE"
155;7;"GREEN DROP EARRINGS W BEAD CLUSTER"
155;7;"DROP EARRINGS W FLOWER & LEAF"
155;7;"GOLD/AMBER DROP EARRINGS W LEAF"
