"node";"cluster";"description"
1;1;"TOY TIDY PINK POLKADOT"
1;1;"POLKADOT RAIN HAT "
1;1;"PINK  POLKADOT PLATE "
1;1;"POLKADOT MUG PINK "
1;1;"PINK POLKADOT CHILDRENS UMBRELLA"
1;1;"MILK PAN PINK POLKADOT"
1;1;"PINK  POLKADOT CUP"
1;1;"PINK POLKADOT BOWL"
1;1;"PINK POLKADOT WRAP "
1;1;"FRYING PAN PINK POLKADOT"
1;1;"PARTY PIZZA DISH PINK POLKADOT"
1;1;"CUBIC MUG PINK POLKADOT"
1;1;"PINK POLKADOT GARDEN PARASOL"
1;1;"CHILDRENS CUTLERY POLKADOT PINK"
1;1;"MULTICOLOUR POLKADOT PLATE"
1;1;"PINK POLKADOT PLATE "
2;1;"FELTCRAFT HAIRBAND RED AND BLUE"
2;1;"FELTCRAFT HAIRBAND PINK AND PURPLE"
2;1;"FELTCRAFT HAIRBANDS PINK AND WHITE "
2;1;"FELTCRAFT HAIRBAND PINK AND BLUE"
3;2;"PINK ROSE FABRIC MIRROR"
3;2;"SOFT PINK ROSE TOWEL "
3;2;"PINK ROSE WASHBAG"
3;2;"BLUE ROSE PATCH PURSE PINK BUTTERFL"
3;2;"S/3 PINK SQUARE PLANTERS ROSES"
4;2;"CHILDS GARDEN SPADE PINK"
4;2;"CHILDS GARDEN RAKE PINK"
4;2;"CHILDS GARDEN BRUSH PINK"
4;2;"CHILDRENS GARDEN GLOVES PINK"
4;2;"CHILDS GARDEN TROWEL PINK"
4;2;"CHILDS GARDEN FORK PINK"
5;3;"BLUE FLOCK GLASS CANDLEHOLDER"
5;3;"PINK GLASS CANDLEHOLDER"
5;3;"PINK FLOCK GLASS CANDLEHOLDER"
5;3;"PINK CLEAR GLASS CANDLE PLATE"
5;3;"LIGHT PINK FLOCK GLASS CANDLEHOLDER"
6;3;"HANGING GLASS ETCHED TEALIGHT"
6;3;"MILK BOTTLE WITH GLASS STOPPER "
6;3;"RIDGED GLASS FINGER BOWL"
6;3;"GLASS  BEURRE DISH"
6;3;"RIDGED GLASS POSY VASE "
6;3;"EMBOSSED GLASS TEALIGHT HOLDER"
6;3;"CLEAR MILKSHAKE GLASS"
6;3;"JARDIN ETCHED GLASS BUTTER DISH"
6;3;"GLASS CLOCHE LARGE"
6;3;"MOROCCAN TEA GLASS"
6;3;"ETCHED GLASS COASTER"
6;3;"SMOKEY GREY COLOUR D.O.F. GLASS"
6;3;"LARGE PINK GLASS SUNDAE DISH"
6;3;"PINK/WHITE GLASS DEMI CHOKER"
6;3;"JARDIN ETCHED GLASS FRUITBOWL"
6;3;"JARDIN ETCHED GLASS CHEESE DISH"
6;3;"GLASS CAKE COVER AND PLATE"
6;3;"GLASS CHALICE GREEN  LARGE "
6;3;"LARGE ZINC GLASS CANDLEHOLDER"
6;3;"GLASS APOTHECARY BOTTLE PERFUME"
6;3;"GLASS APOTHECARY BOTTLE ELIXIR"
6;3;"GLASS APOTHECARY BOTTLE TONIC"
6;3;"CORDIAL GLASS JUG"
6;3;"SMOKEY GREY COLOUR GLASS"
7;3;"GLASS CLOCHE SMALL"
7;3;"SMALL GLASS HEART TRINKET POT"
7;3;"SMALL SQUARE CUT GLASS CANDLESTICK"
7;3;"SMALL GLASS SUNDAE DISH CLEAR"
7;3;"GLASS CHALICE GREEN  SMALL "
7;3;"SMALL PINK GLASS SUNDAE DISH"
7;3;"SMALL ROUND CUT GLASS CANDLESTICK"
7;3;"SMALL CHUNKY GLASS ROMAN  BOWL"
7;3;"GLASS CHALICE BLUE SMALL "
7;3;"BLACK SMALL GLASS CAKE STAND"
7;3;"PINK SMALL GLASS CAKE STAND"
8;3;"ANTIQUE GLASS DRESSING TABLE POT"
8;3;"ANTIQUE SILVER TEA GLASS ENGRAVED"
8;3;"ANTIQUE GLASS PEDESTAL BOWL"
8;3;"T-LIGHT GLASS FLUTED ANTIQUE"
8;3;"ANTIQUE SILVER TEA GLASS ETCHED"
8;3;"ANTIQUE ALL GLASS CANDLESTICK"
8;3;"ANTIQUE GLASS PLACE SETTING"
8;3;"ANTIQUE SILVER T-LIGHT GLASS"
9;3;"SILVER HANGING T-LIGHT HOLDER"
9;3;"T-LIGHT HOLDER HANGING LACE"
9;3;"HANGING JAM JAR T-LIGHT HOLDER"
9;3;"HANGING BAUBLE T-LIGHT HOLDER SMALL"
9;3;"HANGING BAUBLE T-LIGHT HOLDER LARGE"
9;3;"T-LIGHT HOLDER SWEETHEART HANGING"
9;3;"SMALL BONNE JAM JAR  T-LIGHT HOLDER"
9;3;"RIDGED BONNE JAM JAR T-LIGHT HOLDER"
9;3;"LARGE BONNE JAM JAR  T-LIGHT HOLDER"
9;3;"HANGING JAM JAR T-LIGHT HOLDERS"
9;3;"HANGING  BUTTERFLY T-LIGHT HOLDER"
9;3;"T-LIGHT HOLDER HANGING LOVE BIRD"
10;3;"WHITE HANGING HEART T-LIGHT HOLDER"
10;3;"RED HANGING HEART T-LIGHT HOLDER"
10;3;"HANGING HEART ZINC T-LIGHT HOLDER"
10;3;"SINGLE HEART ZINC T-LIGHT HOLDER"
10;3;"HEART T-LIGHT HOLDER "
10;3;"ZINC HEART LATTICE T-LIGHT HOLDER"
10;3;"HANGING HEART JAR T-LIGHT HOLDER"
10;3;"HEART T-LIGHT HOLDER"
10;3;"FOLK ART METAL HEART T-LIGHT HOLDER"
10;3;"ZINC HEART FLOWER T-LIGHT HOLDER"
10;3;"ZINC  HEART T-LIGHT HOLDER"
10;3;"HEART T-LIGHT HOLDER WILLIE WINKIE"
10;3;"T-LIGHT HOLDER SILVER HEART HANDLE"
10;3;"HEART TRELLISTRIPLE T-LIGHT HOLDER"
10;3;"HEART TRELLIS TRIPLE T-LIGHT HOLDER"
10;3;"PINK HANGING HEART T-LIGHT HOLDER"
10;3;"CREAM HANGING HEART T-LIGHT HOLDER"
11;4;"CHRISTMAS TREE T-LIGHT HOLDER"
11;4;"FOLKART CHRISTMAS TREE T-LIGHT HOLD"
12;4;"CHRISTMAS CRAFT TREE TOP ANGEL"
12;4;"TURQUOISE CHRISTMAS TREE "
12;4;"CHRISTMAS GINGHAM TREE"
12;4;"CHRISTMAS RETROSPOT TREE WOOD"
12;4;"CHRISTMAS HANGING TREE WITH BELL"
12;4;"GLITTER CHRISTMAS TREE WITH BELLS"
12;4;"SILVER CHRISTMAS TREE BAUBLE STAND "
12;4;"WOODEN TREE CHRISTMAS SCANDINAVIAN"
12;4;"GLITTER CHRISTMAS TREE"
12;4;"SMALL PINK MAGIC CHRISTMAS TREE"
12;4;"CARDHOLDER GINGHAM CHRISTMAS TREE"
12;4;"CHRISTMAS TREE PAINTED ZINC "
12;4;"CHRISTMAS MUSICAL ZINC TREE"
12;4;"CHRISTMAS TREE HANGING SILVER "
12;4;"CHRISTMAS TREE HANGING GOLD"
13;4;"BISCUIT TIN 50'S CHRISTMAS"
13;4;"GIANT 50'S CHRISTMAS CRACKER"
13;4;"WRAP 50'S  CHRISTMAS"
13;4;"6 GIFT TAGS 50'S CHRISTMAS "
13;4;"ROLL WRAP 50'S RED CHRISTMAS "
13;4;"ROLL WRAP 50'S CHRISTMAS"
13;4;"3 RAFFIA RIBBONS 50'S CHRISTMAS "
14;4;"CHRISTMAS HANGING HEART WITH BELL"
14;4;"CHRISTMAS GINGHAM HEART"
14;4;"WOODEN HEART CHRISTMAS SCANDINAVIAN"
14;4;"FOLKART ZINC HEART CHRISTMAS DEC"
14;4;"CHRISTMAS MUSICAL ZINC HEART "
14;4;"GLITTER CHRISTMAS HEART "
14;4;"CHRISTMAS RETROSPOT HEART WOOD"
14;4;"CHRISTMAS CRAFT HEART STOCKING "
15;4;"IVY HEART WREATH"
15;4;"MISTLETOE HEART WREATH CREAM"
15;4;"MISTLETOE HEART WREATH GREEN"
15;4;"MISELTOE HEART WREATH WHITE"
15;4;"MISELTOE HEART WREATH "
15;4;"HEART SHAPED HOLLY WREATH"
15;4;"MISELTOE HEART WREATH CREAM"
15;4;"PAINTED HEART WREATH WITH BELL"
16;4;"LAVENDER SCENTED FABRIC HEART"
16;4;"FRENCH STYLE EMBOSSED HEART CABINET"
16;4;"FRENCH LAVENDER SCENT HEART"
17;1;"LADLE LOVE HEART RED "
17;1;"LADLE LOVE HEART PINK"
17;1;"LOVE HEART NAPKIN BOX "
17;1;"RED HEART SHAPE LOVE BUCKET "
17;1;"PINK  HEART SHAPE LOVE BUCKET "
17;1;"6 CHOCOLATE LOVE HEART T-LIGHTS"
17;1;"LOVE HEART SOCK HANGER"
17;1;"LOVE HEART POCKET WARMER"
17;1;"RED FLOCK LOVE HEART PHOTO FRAME"
17;1;"PINK LOVE HEART SHAPE CUP"
17;1;"RED LOVE HEART SHAPE CUP"
17;1;"BATHROOM SET LOVE HEART DESIGN"
17;1;"BEADED LOVE HEART JEWELLERY SET"
17;1;"CERAMIC BOWL WITH LOVE HEART DESIGN"
17;1;"MINI LADLE LOVE HEART PINK"
17;1;"LOVE HEART TRINKET POT"
17;1;"MINI LADLE LOVE HEART RED "
17;1;"HAND WARMER RED LOVE HEART"
18;1;"RED WOOLLY HOTTIE WHITE HEART."
18;1;"GINGHAM HEART  DOORSTOP RED"
18;1;"GINGHAM OVEN GLOVE RED HEART "
18;1;"RED HEARTS LIGHT CHAIN "
18;1;"RED PURSE WITH PINK HEART"
18;1;"PINK HEART RED HANDBAG"
19;1;"EDWARDIAN PARASOL RED"
19;1;"RED CHARLIE+LOLA PERSONAL DOORSIGN"
19;1;"SILK PURSE BABUSHKA RED"
19;1;"SCANDINAVIAN REDS RIBBONS"
19;1;"RED  HARMONICA IN BOX "
19;1;"RED METAL BEACH SPADE "
19;1;"ROCKING HORSE RED CHRISTMAS "
19;1;"RED KITCHEN SCALES"
19;1;"MEASURING TAPE BABUSHKA RED"
19;1;"WRAP RED APPLES "
19;1;"RED SHARK HELICOPTER"
19;1;"TEA COSY RED  STRIPE"
19;1;"RED BABY BUNTING "
19;1;"RED VICTORIAN FABRIC OVAL BOX"
19;1;"RED DRAGONFLY HELICOPTER"
19;1;"RED POLKADOT PUDDING BOWL"
19;1;"SPACE CADET RED"
19;1;"TABLECLOTH RED APPLES DESIGN "
19;1;"RED ROSE AND LACE C/COVER"
19;1;"SPOTS ON RED BOOKCOVER TAPE"
19;1;"RED PAPER PARASOL"
19;1;"LARGE TORTILLA DESIGN RED BOWL"
19;1;"RED PUDDING SPOON"
19;1;"RED  EGG  SPOON"
19;1;"RED POLKADOT BEAKER "
19;1;"RED DAISY PAPER LAMPSHADE"
19;1;"RECYCLED ACAPULCO MAT RED"
19;1;"RED REFECTORY CLOCK "
19;1;"RED PEONY TABLE CLOCK"
19;1;"RED APPLES CHOPPING BOARD   "
20;1;"WHITE SPOT RED CERAMIC DRAWER KNOB"
20;1;"RED DRAWER KNOB ACRYLIC EDWARDIAN"
20;1;"CLEAR DRAWER KNOB ACRYLIC EDWARDIAN"
20;1;"PINK DRAWER KNOB ACRYLIC EDWARDIAN"
20;1;"GREEN DRAWER KNOB ACRYLIC EDWARDIAN"
20;1;"BLUE DRAWER KNOB ACRYLIC EDWARDIAN"
20;1;"BLUE SPOT CERAMIC DRAWER KNOB"
20;1;"RED STRIPE CERAMIC DRAWER KNOB"
20;1;"RED SPOT CERAMIC DRAWER KNOB"
20;1;"BLUE STRIPE CERAMIC DRAWER KNOB"
20;1;"WHITE SPOT BLUE CERAMIC DRAWER KNOB"
20;1;"DRAWER KNOB CERAMIC IVORY"
20;1;"DRAWER KNOB CRACKLE GLAZE IVORY"
20;1;"DRAWER KNOB CRACKLE GLAZE BLUE"
20;1;"DRAWER KNOB CRACKLE GLAZE PINK"
20;1;"DRAWER KNOB CRACKLE GLAZE GREEN"
20;1;"DRAWER KNOB CERAMIC RED"
20;1;"DRAWER KNOB CERAMIC BLACK"
20;1;"DRAWER KNOB VINTAGE GLASS STAR"
20;1;"DRAWER KNOB VINTAGE GLASS HEXAGON"
20;1;"DRAWER KNOB VINTAGE GLASS BALL"
21;1;"BLACK/BLUE POLKADOT UMBRELLA"
21;1;"FOLDING UMBRELLA PINKWHITE POLKADOT"
21;1;"FOLDING UMBRELLA CREAM POLKADOT"
21;1;"FOLDING UMBRELLA WHITE/RED POLKADOT"
21;1;"FOLDING UMBRELLA RED/WHITE POLKADOT"
21;1;"FOLDING UMBRELLA CHOCOLATE POLKADOT"
21;1;"FOLDING UMBRELLA BLACKBLUE POLKADOT"
22;1;"PINK BREAKFAST CUP AND SAUCER "
22;1;"POLKADOT COFFEE CUP & SAUCER PINK"
22;1;"PINK CHERRY BLOSSOM CUP & SAUCER"
23;2;"SWISS ROLL TOWEL, CHOCOLATE  SPOTS"
23;2;"SWISS ROLL TOWEL, PINK  SPOTS"
23;2;"PINK SPOTS CHOCOLATE NESTING BOXES "
23;2;"SWISS ROLL TOWEL PINK  SPOTS"
24;2;"GIRLY PINK TOOL SET"
24;2;"LIGHT GARLAND BUTTERFILES PINK"
24;2;"JAM JAR WITH PINK LID"
24;2;"SILK PURSE BABUSHKA PINK"
24;2;"ROMANTIC PINKS RIBBONS "
24;2;"PINK B'FLY C/COVER W BOBBLES"
24;2;"PINK CHRISTMAS FLOCK DROPLET "
24;2;"MOUSE TOY WITH PINK T-SHIRT"
24;2;"DOG TOY WITH PINK CROCHET SKIRT"
24;2;"PINK BUTTERFLY HANDBAG W BOBBLES"
24;2;"DENIM PATCH PURSE PINK BUTTERFLY"
24;2;"PINK  HONEYCOMB PAPER BALL "
24;2;"SPOTTY PINK DUCK DOORSTOP"
24;2;"FEATHER PEN,LIGHT PINK"
24;2;"FEATHER PEN,HOT PINK"
24;2;"EDWARDIAN PARASOL PINK"
24;2;"PINK MARSHMALLOW SCARF KNITTING KIT"
24;2;"KIDS RAIN MAC PINK"
24;2;"PINK BABY BUNTING"
24;2;"PINK HAPPY BIRTHDAY BUNTING"
24;2;"PIN CUSHION BABUSHKA PINK"
24;2;"PINK HORSE SOCK PUPPET"
24;2;"MEASURING TAPE BABUSHKA PINK"
24;2;"WRAP  PINK FLOCK"
24;2;"NINJA RABBIT PINK"
24;2;"PINK DOG BOWL"
24;2;"PINK PAINTED KASHMIRI CHAIR"
24;2;"PINK PADDED MOBILE"
24;2;"PAIR PADDED HANGERS PINK CHECK"
24;2;"CAKE PLATE LOVEBIRD PINK"
24;2;"PINK PARTY SUNGLASSES"
24;2;"MEDIUM PINK BUDDHA HEAD "
24;2;"ENAMEL PINK TEA CONTAINER"
24;2;"PINK CAT BOWL"
24;2;"PINK REGENCY TEACUP AND SAUCER"
24;2;"PAINTED PINK RABBIT "
24;2;"PINK BUTTERFLY WASHBAG"
24;2;"PINK GINGHAM CAT WITH SCARF"
24;2;"PINK BITTY LIGHT CHAIN"
24;2;"PINK METAL SWINGING BUNNY"
24;2;"PINK DOG CANNISTER"
24;2;"PINK FLY SWAT"
24;2;"ENAMEL PINK COFFEE CONTAINER"
24;2;"PINK MONTE CARLO HANDBAG"
24;2;"FLORAL PINK MONSTER"
24;2;"PINK ROSEBUD PEARL EARRINGS"
24;2;"PINK STRAWBERRY HANDBAG "
24;2;"PINK PAPER PARASOL "
24;2;"PINK DOLLY HAIR CLIPS"
24;2;"PINK SQUARE TABLE CLOCK"
24;2;"PINK CHERRY LIGHTS"
24;2;"PINK HANGING GINGHAM EASTER HEN"
24;2;"FLAMES SUNGLASSES PINK LENSES"
24;2;"PINK GAUZE BUTTERFLY LAMPSHADE"
24;2;"NECKLACE+BRACELET PINK BUTTERFLY"
24;2;"PINK DISCO HANDBAG"
24;2;"PINK RIVIERA HANDBAG"
24;2;"NECKLACE+BRACELET SET PINK DAISY"
24;2;"RECYCLED ACAPULCO MAT PINK"
24;2;"PASTEL PINK PHOTO ALBUM "
24;2;"REGENCY MILK JUG PINK "
24;2;"REGENCY TEA PLATE PINK"
24;2;"PINK EASTER HENS+FLOWER"
24;2;"ROUND ARTICULATED PINK CLOCK W/SUCK"
24;2;"PINK HORSE SOCK PUPPET KIT"
25;2;"CUBIC MUG FLOCK BLUE ON BROWN"
25;2;"CUBIC MUG FLOCK PINK ON BROWN"
25;2;"BLUE NEW BAROQUE FLOCK CANDLESTICK"
25;2;"PINK NEW BAROQUE FLOCK CANDLESTICK"
26;3;"RIDGED GLASS STORAGE JAR CREAM LID"
26;3;"GLASS JAR ENGLISH CONFECTIONERY"
26;3;"GLASS JAR DIGESTIVE BISCUITS"
26;3;"GLASS JAR KINGS CHOICE"
26;3;"GLASS JAR DAISY FRESH COTTON WOOL"
26;3;"GLASS BELL JAR SMALL"
26;3;"GLASS BELL JAR LARGE"
26;3;"GLASS JAR MARMALADE "
26;3;"GLASS JAR PEACOCK BATH SALTS"
26;3;"JARDIN ETCHED GLASS SMALL BELL JAR"
26;3;"JARDIN ETCHED GLASS LARGE BELL JAR"
26;3;"CLASSIC GLASS SWEET JAR"
26;3;"GLASS BON BON JAR"
26;3;"CLASSIC GLASS COOKIE JAR"
26;3;"GLASS  SONGBIRD STORAGE JAR"
26;3;"GLASS TWIST BON BON JAR"
26;3;"GLASS BONNE JAM JAR"
26;3;"GLASS SONGBIRD STORAGE JAR"
27;3;"FIRE POLISHED GLASS NECKL GREEN"
27;3;"FIRE POLISHED GLASS BRACELET BLACK"
27;3;"FIRE POLISHED GLASS NECKL BRONZE"
27;3;"FIRE POLISHED GLASS BRACELET MONTAN"
27;3;"FIRE POLISHED GLASS BRACELET GREEN"
27;3;"FIRE POLISHED GLASS NECKL GOLD"
27;3;"FIRE POLISHED GLASS BRACELET RED"
28;3;"SET/5 RED RETROSPOT LID GLASS BOWLS"
28;3;"SET/5 RED SPOTTY LID GLASS BOWLS"
29;3;"GLASS STAR FROSTED T-LIGHT HOLDER"
29;3;"COLOUR GLASS T-LIGHT HOLDER HANGING"
29;3;"VICTORIAN GLASS HANGING T-LIGHT"
29;3;"AGED GLASS SILVER T-LIGHT HOLDER"
29;3;"GLASS HEART T-LIGHT HOLDER "
29;3;"COLOUR GLASS. STAR T-LIGHT HOLDER"
29;3;"CUT GLASS HEXAGON T-LIGHT HOLDER"
29;3;"RIDGED GLASS T-LIGHT HOLDER"
29;3;"CUT GLASS T-LIGHT HOLDER OCTAGON"
29;3;"GOLD SCROLL GLASS T-LIGHT HOLDER"
29;3;"HANGING RIDGE GLASS T-LIGHT HOLDER"
29;3;"VINTAGE GLASS T-LIGHT HOLDER"
29;3;"COLOURED GLASS STAR T-LIGHT HOLDER"
30;3;"STAR  T-LIGHT HOLDER "
30;3;"FOLK ART METAL STAR T-LIGHT HOLDER"
30;3;"ZINC T-LIGHT HOLDER STARS SMALL"
30;3;"ZINC T-LIGHT HOLDER STAR LARGE"
30;3;"ZINC  STAR T-LIGHT HOLDER "
30;3;"ZINC T-LIGHT HOLDER STARS LARGE"
30;3;"ZINC STAR T-LIGHT HOLDER "
30;3;"STAR T-LIGHT HOLDER WILLIE WINKIE"
31;3;"ZINC FINISH 15CM PLANTER POTS"
31;3;"WHITE WIRE PLANT POT HOLDER"
31;3;"ZINC HEARTS PLANT POT HOLDER"
31;3;"WHITE HEARTS WIRE PLANT POT HOLDER"
31;3;"ZINC PLANT POT HOLDER"
32;4;"PINK/WHITE CHRISTMAS TREE 60CM"
32;4;"PINK AND WHITE CHRISTMAS TREE 120CM"
32;4;"WHITE GOOSE FEATHER CHRISTMAS TREE "
32;4;"BLACK CHRISTMAS TREE 60CM"
32;4;"BLACK CHRISTMAS TREE 120CM"
32;4;"GREEN GOOSE FEATHER TREE 60CM"
32;4;"PINK GOOSE FEATHER TREE 60CM"
32;4;"DUSTY PINK CHRISTMAS TREE 30CM"
32;4;"BLACKCHRISTMAS TREE 30CM"
32;4;"WHITE GOOSE FEATHER TREE 60CM "
32;4;"PINK/WHITE CHRISTMAS TREE 30CM"
32;4;"WHITE CHRISTMAS TREE 60CM"
32;4;"DUSTY PINK CHRISTMAS TREE 60CM"
33;4;"WHITE CHRISTMAS GARLAND STARS TREES"
33;4;"CHRISTMAS GARLAND STARS,TREES"
34;4;"TRADITIONAL CHRISTMAS RIBBONS"
34;4;"FELTCRAFT CHRISTMAS FAIRY"
34;4;"CHRISTMAS CRAFT LITTLE FRIENDS"
34;4;"CHRISTMAS GINGHAM STAR"
34;4;"CHRISTMAS HANGING STAR WITH BELL"
34;4;"CHRISTMAS TOILET ROLL"
34;4;"CHRISTMAS RETROSPOT STAR WOOD"
34;4;"SMALLFOLKART BAUBLE CHRISTMAS DEC"
34;4;"CHRISTMAS MUSICAL ZINC STAR"
34;4;"SMALL FOLKART STAR CHRISTMAS DEC"
34;4;"WOODEN STAR CHRISTMAS SCANDINAVIAN"
34;4;"FOLKART CLIP ON STARS"
34;4;"FOLKART ZINC STAR CHRISTMAS DEC"
34;4;"GLITTER CHRISTMAS STAR "
34;4;"CHRISTMAS STAR WISH LIST CHALKBOARD"
35;4;"IVORY SHELL HEART EARRINGS"
35;4;"IVORY SHELL HEART NECKLACE"
35;4;"IVORY WICKER HEART MEDIUM"
36;4;"MIDNIGHT BLUE PAIR HEART HAIR SLIDE"
36;4;"PAIR BUTTERFLY HAIR CLIPS"
36;4;"GREEN PAIR HEART HAIR SLIDES"
36;4;"ROSE COLOUR PAIR HEART HAIR SLIDES"
36;4;"CRYSTAL PAIR HEART HAIR SLIDES"
37;1;"BEADED PEARL HEART WHITE ON STICK"
37;1;"BEADED PEARL HEART WHITE LARGE"
38;1;"CREAM CUPID HEARTS COAT HANGER"
38;1;"NATURAL SLATE HEART CHALKBOARD "
38;1;"JAZZ HEARTS PURSE NOTEBOOK"
38;1;"PARTY INVITES JAZZ HEARTS"
38;1;"FELTCRAFT BUTTERFLY HEARTS"
38;1;"CHEST OF DRAWERS GINGHAM HEART "
38;1;"HEART GARLAND RUSTIC PADDED"
38;1;"CREAM WALL PLANTER HEART SHAPED"
38;1;"JAZZ HEARTS ADDRESS BOOK"
38;1;"FINE WICKER HEART "
38;1;"MOBILE VINTAGE HEARTS "
38;1;"FOLKART HEART NAPKIN RINGS"
38;1;"YELLOW METAL CHICKEN HEART "
38;1;"FILIGRIS HEART WITH BUTTERFLY"
38;1;"HEARTS  STICKERS"
38;1;"SCANDINAVIAN 3 HEARTS NAPKIN RING"
38;1;"MULTI HEARTS  STICKERS"
38;1;"HEART CALCULATOR"
38;1;"HEART SHAPE WIRELESS DOORBELL"
38;1;"HEART SHAPED MIRROR"
38;1;"ALUMINIUM STAMPED HEART"
38;1;"VINTAGE EMBOSSED HEART"
38;1;"VINTAGE ENGRAVED HEART"
38;1;"ALUMINIUM HEART"
38;1;"RUSTIC MIRROR WITH LACE HEART"
38;1;"SWEET HEART CAKE CARRIER"
38;1;"VINTAGE JINGLE BELLS HEART"
39;1;"RED GINGHAM TEDDY BEAR "
39;1;"BABY MOUSE RED GINGHAM DRESS"
39;1;"MUMMY MOUSE RED GINGHAM RIBBON"
39;1;"SNACK TRAY RED GINGHAM"
40;1;"HAND WARMER RED POLKA DOT"
40;1;"HAND WARMER RED RETROSPOT"
40;1;"WHITE ROCKING HORSE HAND PAINTED"
40;1;"RED ROCKING HORSE HAND PAINTED"
41;5;"JUMBO BAG PINK POLKADOT"
41;5;"LUNCH BAG PINK POLKADOT"
41;5;"CHARLOTTE BAG PINK POLKADOT"
41;5;"PINK POLKADOT KIDS BAG"
42;2;"PINK OVAL JEWELLED MIRROR"
42;2;"ACRYLIC JEWEL ICICLE, PINK"
42;2;"PINK JEWELLED MIRROR TRINKET TRAY"
42;2;"SILVER JEWELLED MIRROR TRINKET TRAY"
42;2;"PINK SMALL JEWELLED PHOTOFRAME"
42;2;"ACRYLIC JEWEL SNOWFLAKE,PINK"
42;2;"EAU DE NILE JEWELLED PHOTOFRAME"
42;2;"PINK LARGE JEWELED PHOTOFRAME"
42;2;"ACRYLIC JEWEL SNOWFLAKE, PINK"
42;2;"PINK ACRYLIC JEWEL SNOWFLAKE"
42;2;"ACRYLIC JEWEL ANGEL,PINK"
42;2;"ACRYLIC JEWEL ICICLE, BLUE"
43;2;"VINTAGE PINK DECORATIVE PARASOL"
43;2;"VINTAGE BEAD PINK PURSE "
43;2;"VINTAGE BEAD PINK SCARF "
43;2;"VINTAGE BEAD PINK EVENING BAG"
43;2;"VINTAGE BEAD PINK SHADE "
43;2;"PINK VINTAGE SPOT BEAKER"
43;2;"VINTAGE BEAD PINK JEWEL BOX"
43;2;"VINTAGE BEAD PINK JEWEL STAND"
44;2;"CRYSTAL FROG PHONE CHARM"
44;2;"CRYSTAL STILETTO PHONE CHARM"
44;2;"CRYSTAL SEA HORSE PHONE CHARM"
44;2;"PINK CRYSTAL SKULL PHONE CHARM"
44;2;"CLEAR CRYSTAL STAR PHONE CHARM"
44;2;"PINK BERTIE MOBILE PHONE CHARM"
44;2;"BLUE CRYSTAL BOOT PHONE CHARM"
44;2;"PINK CRYSTAL GUITAR PHONE CHARM"
44;2;"CRYSTAL CZECH CROSS PHONE CHARM"
44;2;"AMBER BERTIE MOBILE PHONE CHARM"
44;2;"PINK BEADS+HAND PHONE CHARM"
45;2;"GLASS BEAD HOOP EARRINGS BLACK"
45;2;"GLASS BEAD HOOP EARRINGS MONTANA"
45;2;"GLASS BEAD HOOP EARRINGS AMETHYST"
45;2;"GLASS BEAD HOOP EARRINGS GREEN"
45;2;"GLASS BEAD HOOP NECKLACE AMETHYST"
45;2;"GLASS BEAD HOOP NECKLACE GREEN"
45;2;"GLASS BEAD HOOP NECKLACE MONTANA"
45;2;"GLASS BEAD HOOP NECKLACE BLACK"
46;3;"MURANO STYLE GLASS BRACELET BLACK"
46;3;"MURANO STYLE GLASS BRACELET GOLD"
46;3;"MURANO STYLE GLASS BRACELET RED"
46;3;"GLASS AND PAINTED BEADS BRACELET OL"
46;3;"GLASS AND PAINTED BEADS BRACELET TO"
46;3;"GLASS AND BEADS BRACELET IVORY"
47;3;"BLUE GLASS CHUNKY CHARM BRACELET"
47;3;"WHITE GLASS CHUNKY CHARM BRACELET"
47;3;"PINK GLASS CHUNKY CHARM BRACELET"
47;3;"BLACK GLASS BRACELET W HEART CHARMS"
47;3;"TURQUOISE HEART OF GLASS BRACELET"
47;3;"GREEN HEART OF GLASS BRACELET"
47;3;"WHITE HEART OF GLASS BRACELET"
47;3;"PINK HEART OF GLASS BRACELET"
48;3;"ANT COPPER RED BOUDICCA BRACELET"
48;3;"ANT COPPER TURQ BOUDICCA BRACELET"
48;3;"TURQ+RED BOUDICCA LARGE BRACELET"
48;3;"ANT COPPER PINK BOUDICCA BRACELET"
48;3;"ANT COPPER LIME BOUDICCA BRACELET"
48;3;"PURPLE BOUDICCA LARGE BRACELET"
48;3;"RED BOUDICCA LARGE BRACELET"
48;3;"PINK BOUDICCA LARGE BRACELET"
49;3;"SET/9 CHRISTMAS T-LIGHTS SCENTED "
49;3;"ORANGE SCENTED SET/9 T-LIGHTS"
49;3;"SET/6 PURPLE BUTTERFLY T-LIGHTS"
49;3;"SET/6 TURQUOISE BUTTERFLY T-LIGHTS"
49;3;"SET/6 PINK  BUTTERFLY T-LIGHTS"
49;3;"SET/6 EAU DE NIL BIRD T-LIGHTS"
50;3;"BLACK CANDELABRA T-LIGHT HOLDER"
50;3;"ROTATING LEAVES T-LIGHT HOLDER"
50;3;"MULTI COLOUR SILVER T-LIGHT HOLDER"
50;3;"PORCELAIN T-LIGHT HOLDERS ASSORTED"
50;3;"ASSORTED COLOUR T-LIGHT HOLDER"
50;3;"MINI CAKE STAND T-LIGHT HOLDER"
50;3;"PINK TALL PORCELAIN T-LIGHT HOLDER "
50;3;"WHITE TALL PORCELAIN T-LIGHT HOLDER"
50;3;"MIRROR LOVE BIRD T-LIGHT HOLDER"
50;3;"BLACK LOVE BIRD T-LIGHT HOLDER"
50;3;"T-LIGHT HOLDER WHITE LACE"
50;3;"PERIWINKLE T-LIGHT HOLDER"
50;3;"EAU DE NILE JEWELLED T-LIGHT HOLDER"
50;3;"CLEAR LOVE BIRD T-LIGHT HOLDER"
50;3;"MIRROR MOSAIC T-LIGHT HOLDER "
50;3;"PINK BOUDOIR T-LIGHT HOLDER"
50;3;"MIRROR MOSAIC T-LIGHT HOLDER ROUND"
50;3;"WIRE FLOWER T-LIGHT HOLDER"
50;3;"GEMSTONE CHANDELIER T-LIGHT HOLDER"
50;3;"BEADED CHANDELIER T-LIGHT HOLDER"
50;3;"IVORY CHANDELIER T-LIGHT HOLDER"
50;3;"FLOWERS CHANDELIER T-LIGHT HOLDER"
50;3;"CRYSTAL CHANDELIER T-LIGHT HOLDER"
50;3;"TREE T-LIGHT HOLDER WILLIE WINKIE"
50;3;"T-LIGHT HOLDER SILVER PETIT FOUR "
50;3;"T-LIGHT HOLDER SILVER SAUCER"
51;3;"GREEN CHRISTMAS TREE CARD HOLDER"
51;3;"GREEN CHRISTMAS TREE STRING 20LIGHT"
51;3;"GREEN GOOSE FEATHER CHRISTMAS TREE "
52;4;"CHRISTMAS TREE DECORATION WITH BELL"
52;4;"CHRISTMAS TREE HEART DECORATION"
52;4;"CHRISTMAS TREE STAR DECORATION"
52;4;"SWISS CHALET TREE DECORATION "
52;4;"BIRD BOX CHRISTMAS TREE DECORATION"
52;4;"DARK BIRD HOUSE TREE DECORATION"
52;4;"ETCHED GLASS STAR TREE DECORATION"
53;4;"DISCO BALL CHRISTMAS DECORATION"
53;4;"PARTY CONE CHRISTMAS DECORATION "
53;4;"STAR WOODEN CHRISTMAS DECORATION"
53;4;"HEART WOODEN CHRISTMAS DECORATION"
53;4;"SWALLOW WOODEN CHRISTMAS DECORATION"
53;4;"WHITE CHRISTMAS STAR DECORATION"
53;4;"FOLKART STAR CHRISTMAS DECORATIONS"
53;4;"PINK FEATHER CHRISTMAS DECORATION"
53;4;"PINK FLUFFY CHRISTMAS DECORATION"
53;4;"PINK STOCKING CHRISTMAS DECORATION"
53;4;"BLACK FEATHER CHRISTMAS DECORATION"
53;4;"BOX OF 6 CHRISTMAS CAKE DECORATIONS"
54;4;"WHITE JEWELLED HEART DECORATION"
54;4;"HEART BEADED TRELLIS DECORATION"
54;4;"SILVER HEARTS TABLE DECORATION"
54;4;"REINDEER HEART DECORATION SILVER"
54;4;"CHERUB HEART DECORATION GOLD"
54;4;"CHERUB HEART DECORATION SILVER "
54;4;"REINDEER HEART DECORATION GOLD"
55;4;"PLACE SETTING WHITE HEART"
55;4;"ANT WHITE WIRE HEART SPIRAL"
55;4;"FILIGREE HEART BIRD WHITE "
55;4;"FILIGREE HEART BUTTERFLY WHITE "
55;4;"FILIGREE HEART DAISY WHITE"
55;4;"HEART MIRROR ANTIQUE WHITE"
56;4;"ZINC HEART LATTICE CHARGER LARGE"
56;4;"ZINC HEART LATTICE CHARGER SMALL"
56;4;"ZINC HEART LATTICE 2 WALL PLANTER"
56;4;"S/2 ZINC HEART DESIGN PLANTERS"
56;4;"ZINC HEART LATTICE TRAY OVAL "
56;4;"SMALL ZINC HEART WALL ORGANISER"
56;4;"LARGE ZINC HEART WALL ORGANISER"
57;4;"HEART OF WICKER LARGE"
57;4;"LARGE HEART MEASURING SPOONS"
57;4;"HEART IVORY TRELLIS LARGE"
57;4;"HEART FILIGREE DOVE LARGE"
57;4;"LARGE IVORY HEART WALL ORGANISER"
57;4;"LARGE WHITE HEART OF WICKER"
57;4;"IVORY WICKER HEART LARGE"
57;4;"DECORATIVE WICKER HEART LARGE"
57;4;"PEARLISED IVORY HEART LARGE "
57;4;"LARGE HEART FLOWERS HOOK   "
58;4;"WOODLAND LARGE BLUE FELT HEART"
58;4;"WOODLAND LARGE PINK FELT HEART"
58;4;"WOODLAND LARGE RED FELT HEART"
58;4;"WOODLAND SMALL RED FELT HEART"
58;4;"WOODLAND SMALL BLUE FELT HEART"
58;4;"WOODLAND SMALL PINK FELT HEART"
59;1;"MILK PAN RED RETROSPOT"
59;1;"RED RETROSPOT BOWL"
59;1;"RED RETROSPOT PUDDING BOWL"
59;1;"RED RETROSPOT SUGAR JAM BOWL"
59;1;"FRYING PAN RED RETROSPOT"
59;1;"RED RETROSPOT BIG BOWL"
60;1;"SET/2 RED RETROSPOT TEA TOWELS "
60;1;"LUNCH BAG RED RETROSPOT"
60;1;"JUMBO BAG RED RETROSPOT"
60;1;"RED RETROSPOT UMBRELLA"
60;1;"RED RETROSPOT MUG"
60;1;"DOORMAT RED RETROSPOT"
60;1;"RED RETROSPOT PLATE "
60;1;"RED RETROSPOT TAPE"
60;1;"RED RETROSPOT MINI CASES"
60;1;"BIRD DECORATION RED RETROSPOT"
60;1;"RED RETROSPOT OVEN GLOVE "
60;1;"RETROSPOT RED WASHING UP GLOVES"
60;1;"RED RETROSPOT OVEN GLOVE DOUBLE"
60;1;"RED RETROSPOT WRAP "
60;1;"RED RETROSPOT TISSUE BOX"
60;1;"RED RETROSPOT CAKE STAND"
60;1;"TEA BAG PLATE RED RETROSPOT"
60;1;"RED RETROSPOT CHARLOTTE BAG"
60;1;"RED RETROSPOT ROUND CAKE TINS"
60;1;"RED RETROSPOT CUP"
60;1;"RED RETROSPOT CHILDRENS UMBRELLA"
60;1;"RED RETROSPOT SHOPPER BAG"
60;1;"RED RETROSPOT PURSE "
60;1;"RED RETROSPOT APRON "
60;1;"RED RETROSPOT TRADITIONAL TEAPOT "
60;1;"PARTY PIZZA DISH RED RETROSPOT"
60;1;"RED RETROSPOT PEG BAG"
60;1;"RED RETROSPOT BUTTER DISH"
60;1;"RED RETROSPOT SHOPPING BAG"
60;1;"RED RETROSPOT WASHBAG"
60;1;"RED RETROSPOT PICNIC BAG"
60;1;"RED RETROSPOT TEA CUP AND SAUCER "
60;1;"RED RETROSPOT STORAGE JAR"
60;1;"SMALL RED RETROSPOT WINDMILL"
60;1;"LARGE RED RETROSPOT WINDMILL"
60;1;"RED RETROSPOT SMALL MILK JUG"
60;1;"CHILDRENS CUTLERY RETROSPOT RED "
61;5;"AIRLINE BAG VINTAGE TOKYO 78"
61;5;"AIRLINE BAG VINTAGE JET SET WHITE"
61;5;"AIRLINE BAG VINTAGE WORLD CHAMPION "
61;5;"AIRLINE BAG VINTAGE JET SET BROWN"
61;5;"AIRLINE BAG VINTAGE JET SET RED"
61;5;"CABIN BAG VINTAGE RETROSPOT"
61;5;"MODERN VINTAGE COTTON SHOPPING BAG"
61;5;"VINTAGE BEAD COSMETIC BAG "
61;5;"CHARLOTTE BAG VINTAGE ALPHABET "
62;5;"JUMBO BAG VINTAGE LEAF"
62;5;"JUMBO BAG VINTAGE CHRISTMAS "
62;5;"JUMBO BAG VINTAGE DOILEY "
62;5;"JUMBO BAG VINTAGE DOILY "
62;5;"VINTAGE DOILY JUMBO BAG RED "
63;5;"JUMBO BAG PINK VINTAGE PAISLEY"
63;5;"COSMETIC BAG VINTAGE ROSE PAISLEY"
63;5;"WASH BAG VINTAGE ROSE PAISLEY"
63;5;"OVERNIGHT BAG VINTAGE ROSE PAISLEY"
63;5;"CABIN BAG VINTAGE PAISLEY"
63;5;"WEEKEND BAG VINTAGE ROSE PAISLEY"
63;5;"SCANDINAVIAN PAISLEY PICNIC BAG"
63;5;"PINK VINTAGE PAISLEY PICNIC BAG"
64;2;"SUMMER DAISIES BAG CHARM"
64;2;"SUMMER BUTTERFLIES BAG CHARM"
64;2;"PINK DAISY BAG CHARM"
65;2;"BLUE LEAVES AND BEADS PHONE CHARM"
65;2;"PINK LEAVES AND BEADS PHONE CHARM"
65;2;"GREEN LEAVES AND BEADS PHONE CHARM"
65;2;"PURPLE LEAVES AND BEADS PHONE CHAR"
66;3;"5 STRAND GLASS NECKLACE CRYSTAL"
66;3;"5 STRAND GLASS NECKLACE BLACK"
66;3;"5 STRAND GLASS NECKLACE AMETHYST"
66;3;"5 STRAND GLASS NECKLACE AMBER"
66;3;"RUBY GLASS NECKLACE 42"""
67;3;"RUBY GLASS CLUSTER EARRINGS"
67;3;"RUBY GLASS CLUSTER BRACELET"
67;3;"RUBY GLASS CLUSTER NECKLACE"
68;3;"GREEN MURANO TWIST BRACELET"
68;3;"BLUE MURANO TWIST BRACELET"
68;3;"PINK MURANO TWIST BRACELET"
68;3;"WHITE MURANO TWIST BRACELET"
68;3;"TINY CRYSTAL BRACELET GREEN"
68;3;"TINY CRYSTAL BRACELET BLUE"
68;3;"TINY CRYSTAL BRACELET RED"
68;3;"WHITE VINTAGE CRYSTAL BRACELET"
69;3;"BLACK SWEETHEART BRACELET"
69;3;"BLUE SWEETHEART BRACELET"
69;3;"PINK SWEETHEART BRACELET"
69;3;"PURPLE SWEETHEART BRACELET"
69;3;"PURPLE GEMSTONE BRACELET"
69;3;"BLACK GEMSTONE BRACELET"
69;3;"MIDNIGHT BLUE GLASS/SILVER BRACELET"
69;3;"BLACK/WHITE GLASS/SILVER BRACELET"
69;3;"GREEN SWEETHEART BRACELET"
69;3;"CARNIVAL BRACELET"
69;3;"AMBER GLASS/SILVER BRACELET"
69;3;"BLACK CHUNKY BEAD BRACELET W STRAP"
69;3;"TIGRIS EYE CHUNKY CHARM BRACELET"
69;3;"PURPLE LAS VEGAS BRACELET ROUND"
69;3;"AMETHYST CHUNKY BEAD BRACELET W STR"
69;3;"AMBER CHUNKY BEAD BRACELET W STRAP"
69;3;"PINK ROSEBUD PEARL BRACELET"
69;3;"WHITE  ROSEBUD PEARL BRACELET"
69;3;"FRESHWATER PEARL BRACELET GOLD"
69;3;"PINK CRYSTAL+GLASS BRACELET"
69;3;"FRESHWATER PEARL BRACELET IVORY"
69;3;"TURQUOISE CRYSTAL+GLASS BRACELET"
69;3;"RESIN BRACELET W PASTEL BEADS"
69;3;"JADE CRYSTAL+GLASS BRACELET"
70;3;"PEARL CRYSTAL PUMPKIN T-LIGHT HLDR"
70;3;"S/12 VANILLA  BOTANICAL T-LIGHTS"
71;3;"CLASSIC METAL BIRDCAGE PLANT HOLDER"
71;3;"SMALL POPCORN HOLDER"
71;3;"LARGE POPCORN HOLDER "
71;3;"JUNGLE POPSICLES ICE LOLLY HOLDERS"
71;3;"HELLO SAILOR BLUE SOAP HOLDER"
71;3;"HOT BATHS SOAP HOLDER"
71;3;"POPCORN HOLDER"
72;4;"JINGLE BELLS TREE DECORATION"
72;4;"PARTY CONES CANDY TREE DECORATION"
72;4;"ASSORTED EASTER DECORATIONS  BELLS"
72;4;"SILVER BELLS TABLE DECORATION"
72;4;"STAR WREATH DECORATION WITH BELL"
72;4;"PARTY CONES CANDY DECORATION"
73;4;"GLITTER SNOW PEAR TREE DECORATION"
74;4;"ZINC METAL HEART DECORATION"
74;4;"CRAZY DAISY HEART DECORATION"
74;4;"HEART DECORATION WITH PEARLS "
74;4;"HEART DECORATION PAINTED ZINC "
74;4;"ROSE FOLKART HEART DECORATIONS"
